title;duration;certificate;genre;rating;directors;stars
A Monks Madness;NA;NA;Action;NA;NA;Meiting Guan, Song Jin, Yanan Li, Zhang Yuer
Parázs a szívnek;94 min;NA;Drama, Romance;7.1;Zoltán Vámos;Zoltán Bezerédy, Gábor Csöre, Enikö Dobó, Zoltán Dózsa
Toot too ku chart;127 min;NA;Comedy;NA;Poj Arnon;Rattapoom Tokongsup, Petchtai Wongkamlao
Slave;NA;NA;Drama, Thriller;NA;Clenet Verdi-Rose;NA
Charlotte-Susabi;192 min;NA;NA;NA;Masaki Iwana;Clara Elena Cuda, D'Déé, Mamoru Narita, Hiroshi Okazaki
Jesi;NA;NA;Horror;NA;Mohamad Issack;Geethanjali, Hari, Sri Priyanka, RajeshB.
Ojos Negros;NA;NA;Drama;NA;Iván Alarcón, Ivet Castelo, Sandra García, Marta Lallana;Anna Sabaté, Julia Lallana, Alba Alcaine
Lazzaro;80 min;NA;Drama;NA;Paolo Pisoni;Tommaso Benvenuti, Alessandro Scipilliti, Elisa Zanotto
Bond of Brothers;NA;NA;Comedy;NA;Arley Ryder;Arley Ryder, Chris Rickabaugh, Diana Garle, Chelsea Laren
It's a Wondrous Life;NA;NA;Comedy, Drama;NA;Joseph Aniska, Larry Traiger;Joseph Aniska, Douglas Rizzo Johnson, Raul S. Julia, Elizabeth Ruf
Rotting Rage;70 min;NA;Adventure, Horror;NA;Derek Klanfer;Kris Salvi, Aurora Grabill, Dustin Teuber, Dante Savion
Underworld Minus Love;85 min;NA;Adventure, Crime, Drama;NA;Shanel Felicissimo;Georgie Payne, Adriana Galicia, Dakota Kieras, Alexa Rae Bigos
Mare Nostrum;110 min;NA;Drama;6.3;Ricardo Elias;Silvio Guindane, Ricardo Oshiro, Carlos Meceni, Eduardo Acaiabe
Ek Betuke Aadmi Ki Afrah Raatein;NA;NA;Drama;NA;Sharad Raj;Archanna Guptaa, Adil Hussain, Mia Maelzer, Rajveer Verma
Goin' Rectal;70 min;NA;Comedy, Music;8.3;Dennis Alink;Dennis Alink, Justin Buffinga, Jaco de Swart, Horse
Everything Outside;86 min;NA;Drama;NA;David Findlay;Ahmed Muslimani, Louise Portal, Kati Outinen, Sylvain Buffoni
Pilvede all. Neljas õde;115 min;NA;Drama;4.2;Toomas Kirss;Liis Haab, Guido Kangur, Jekaterina Kordas, Krista Lensin
Reefer Lake;NA;NA;Horror;NA;Michael Bilinski;NA
Bañeros 5: Lentos y cargosos;86 min;NA;Comedy;2.0;Rodolfo Ledo;Joaquín Berthold, Alexander Caniggia, Charlotte Caniggia, Pablo Granados
Bad/Asses: Rogue;39 min;NA;Action, Comedy, Crime;8.9;Josh Reiner;Miguel Garcia, Cristian Maraboli, Josh Reiner
Headroom;30 min;NA;Mystery;6.5;Ryan Zimmerman;Nicholas Westerberg, Andrew Nosal, Carter Aakhus, David Nelson
Soft Silhouettes;NA;NA;Drama;NA;Myles Kwesi Hutchful;Myles Kwesi Hutchful, Justin Malachi, Athena Taylor
Tempo Comum;64 min;NA;Drama;6.3;Susana Nobre;Marta Lança, Clara Castanheira, Pedro Castanheira
Joanne;NA;NA;Thriller;8.0;Christopher Morrison;Alex Reid, Flora Plumb, Sally Clawson, Christopher Morrison
Christabel;112 min;NA;Fantasy;NA;Alex Levy-Heller;Milla Fernandez, Lorena Castanheira, Alexandre Rodrigues, Julio Adrião
Lucicreide Vai pra Marte;NA;NA;Comedy;NA;Rodrigo Cesar;Adriana Birolli, Fernando Ceylão, Renato Chocair, Leandro da Matta
Operación Orión;120 min;NA;Action;NA;Rubén Hernández Remón;Francisco Denis, Karina Velasquez, Israel Moreno, Carlos Carrero
A Fine night for dying;NA;NA;Thriller;NA;Ryan Ellis;NA
House of Paranormal 2;NA;NA;Horror;NA;Jeff Profitt;Jeff Profitt
The Doors: Live at the Isle of Wight;NA;NA;Music;7.9;John Albarian;John Densmore, Robby Krieger, Ray Manzarek, Jim Morrison
Kaira: Story That Unfolds the Truth;NA;NA;Action, Thriller;NA;Hardik Pareekh;NA
Figuras;85 min;NA;Drama;NA;Eugenio Canevari;Stella Maris Santo, Valeria Ballerini, Francisco Dominguez, Isabel Rojas
Sughamaai Subbulakshmi;NA;NA;Romance;NA;Karthik Shamalan;Bhagya Arivuckarasu, Saresh D'Seven, Punitah Shanmugam
Melody on Earth;NA;NA;Comedy, Drama, Sci-Fi;8.6;Joshua Courtade;Kristin Mellian, Robert William Ford, Beverly Courtade, Kara Joy Reed
Horseplay 2: Black Beauty;NA;NA;Animation;NA;Sandy Lynn Smith;Scott Lane, Mark Singer, Bob Thiel, Ellen White
El Abuelo;NA;NA;Comedy;7.4;Gustavo Saavedra;Carlos Julio Vega, Sebastian Rubio, Javier Valdés, Rómulo Assereto
Family Secrets;NA;NA;Drama;NA;Serge Rashidi-Zakuani;Chika Nnaemeka, Olivia Madeinlo, Silvano Griffith-Francis, Olive Neysmith-Carby
Concerned Space Wives or The Freelancer;89 min;NA;Drama;NA;Scout Tafoya;Scout Tafoya
The Academy of Magic;NA;NA;Animation;NA;NA;NA
Kirakira megane;NA;NA;Comedy;NA;Kazutoshi Inudô;Masanobu Andô, Seika Furuhata, Chizuru Ikewaki, Hiroto Kanei
Into the Valli;NA;NA;Drama, Thriller;8.5;Pat Bradley, Nick Buscarino;Hollin Haley, Tia Link, Nathalie Rock, Douglas Taurel
Tim;NA;NA;Drama, War;6.3;Onur Yigit;Esra Erden Atacan, Serdar Atacan, Fercan Bay, Selahattin Bel
Halfway to Hell;87 min;NA;Thriller;8.0;Chris Simoes;Rusty Smith, Lisa Baxley, Jolene Boston, Joshua Haire
Endohell Terminus;60 min;NA;Horror;NA;Germán Favier;Anee Borgonovo, Silvina Bruggo, Patricia Casey, Daniela Rodriguez de Rocco
Il sentiero del rimorso;NA;NA;Drama;NA;Mirko Zaru;NA
Blood & Coffee;NA;NA;Horror;NA;Benjamin Barton;NA
Premaku Raincheck;148 min;NA;Romance;NA;Akelia Peri Srinivas;Monica Tavanam, Abhilash Vadada, Priya Vadiamani
Dry day;NA;NA;Romance;NA;Pandurang Jadhav;Monalisa Bagal, Parth Ghadage, Ayli Ghiya, Chinmay Kambali
The River;95 min;NA;Drama;7.2;Juan Pablo Richter;Fernando Arze, Julia Hernandez, Santiago Rozo, Valentina Villalpando
Abyss;8 min;NA;Drama;NA;Kate Taylor-James;Mary O'Hagan, Jahmai Massai, Michael Sheldon, Francesco Toschi
Margarita 2;98 min;NA;Comedy, Family;7.3;Frank Pérez-Garland;Francisca Aronsson, Giovanni Ciccia, Melania Urbina, César Ritter
Mundo De Lobas;NA;NA;Action;NA;Ivelize Santiago;Jose Jimenez, Ivelize Santiago
Sprawl;NA;NA;Thriller;NA;Brad Champagne;Karnell Matthews, Natalie Kabenjian, Shudan Wang, Jonathan Cahill
Murdery Christmas;NA;NA;Horror, Thriller;NA;Chanel James;Lola Kraft, Ella Garland, Thomas Webb
My Dead Selfie;97 min;NA;Horror;NA;Joy Shannon;Sharena Walker, A.J. Garrett, Jordan Alcoba, Mike Bingaman
Fighter from the Docks;NA;NA;Drama;NA;Peter Sinseeya;Jake Abraham, Pamela Ashton, Christian Greenway, Daniel .P. Lewis
Kazoku no Hanashi;NA;NA;Drama, Family;NA;Takeyoshi Yamamoto;Masaki Okada, Saburô Tokitô, Naomi Zaizen, Riko Narumi
Ground Control;NA;NA;Mystery;NA;Theophile Minuit;Hannah Savage
Desperate Ghosts;96 min;NA;Fantasy, Mystery, Thriller;NA;Pascal Ilie Virgil;Alan O'Silva, Edurne San Jose Eraso, Ionut Ciocia, Francisco Vazquez
Forest of Paranormal;NA;NA;Horror;NA;Jeff Profitt;Jeff Profitt
The Karma;NA;NA;Action;NA;Dev Kumar Shrestha;Buddhi Tamang, Neeta Dhungana, Pramita Rl Rana, Karan Verma
Meri Mamu;NA;NA;Drama;NA;Yam Thapa;Kusum Gurung, Ayub Sen, Saruk Tamrakar, Aaslesha Thakuri
Election Shuffle;NA;NA;Family;NA;Christopher Santos Pyant;Rodriana Jordan, Ansel Carpenter, Michonni Ward, Maxie Jones
Scratch;51 min;NA;Comedy, Horror;NA;Tristan Convert;Chef BeLive, Chris Bound, Rachel Amanda Bryant, Charles Chudabala
I'll Be Damned;100 min;NA;Sci-Fi;NA;John Regan;Mike Powers, Kevin Tan
Roach;NA;NA;Horror;NA;Trent A Johnson;Huberto Villarreal, Johnny Canizales, Antonio Vines, Gregory Olusola Nicholas
Pugilistica the Movie;75 min;NA;Sport;NA;Michael Gerald;NA
Case 137;NA;NA;Drama;NA;Nuri Bauswell;Michael Barbee, Timothy John Bates Jr, Geo Benson, Heather Fairbanks
Parallel Chords;98 min;NA;Drama;NA;Catherine Dudley-Rose;Rachel Ann, Bjorn Johnson, Laura Kirk, Ella Fallon
Strictly Professional;88 min;NA;Comedy, Romance;NA;Sean Brown;Jason Bailes, Ami C. Ericson, Antoine Johnson, Calvin Morie McCarthy
Jenius - Countdown in the Riddle;NA;NA;Sci-Fi;NA;Qingjie Zeng;Siyu Chen, Rayna Wang, Xi Xiao
Shadows on the Road;72 min;NA;Drama, Mystery, Thriller;7.4;Noam Kroll;Patrick J. Andersen, Joe Coffey, Drew Hale, Lindsey Hutchison
Bhay;124 min;NA;Thriller;NA;Rahul Bhatankar;Abhijeet Khandkekar, Smitha Gondkar, Sanskruti Balgude, Siddharth Bodke
Barzaj;NA;NA;NA;NA;Alejandro González Salgado;NA
Once Upon a Family;111 min;NA;Comedy;NA;Pascal Amanfo;Kisa Gbekle, Richmond Amoako, Prince David, Mercy Johnson
Electrician's Day;9 min;NA;Animation, Comedy, Drama;NA;Vladimir Leschiov;NA
It's Just Us;NA;NA;Thriller;NA;James Randall;Christina Roz, Natalie Dale Stephens, Raviteja Cherughattu, Brady Birge
Dirty Walls;5 min;NA;Drama;NA;Nicolas Naranjo;Anouk, Nicolas Naranjo
Autoportrait;64 min;NA;Drama, History, Mystery;NA;Ruben Kochar;Hovhannes Babakhanyan, Alla Sahakyan, Aren Vatyan, Albert Safaryan
Bleachy Doomsday;NA;NA;Comedy, Drama;NA;Toby Hyder;Tom Berkeley, Adam Boardman, Graham Cawte, Doug Cooper
The Idea of Manhood;NA;NA;NA;NA;Serge Kushnier;Karl Bury, Jeremy Kushnier, Elizabeth Masucci, Meg McCrossen
The Rangers: Bloodstone;106 min;NA;Fantasy;NA;David Nordquist;David Nordquist, Dave Quirk, Wendy Tuck, Ken Nordquist
Something Crashed in the Woods;NA;NA;Horror, Sci-Fi;NA;Jeff Profitt;Jeff Profitt
Mast Kalandar;NA;NA;Romance;NA;Rajkumar Aditthyaa;Nitin Gowda, Swaroopini
Barback;NA;NA;Comedy;NA;NA;NA
Ikiru machi;NA;NA;Drama;NA;Hideo Sakaki;Mari Natsuki, Hideko Hara, Arata Horii, Hôshi Ishida
The Ex;NA;NA;Comedy, Romance;5.2;Elvis Deane;Hana Holubec, Jim Kim, Tess Barao, Helen Hayden
Sequence of Events Presents : DENNIS & HENRY'S POST-DIVORCE CHECKLIST;NA;NA;Comedy;NA;Raymond Kester, Bryan Wilson;Bryan Wilson, Shay Dickerhoff, Raymond Kester
Good Friday;NA;NA;Crime;NA;Sal Rinella;Pat Marone, Bella DiMartini, Salvatore Mirando
DISTORSIÓN, En medio del caos;70 min;NA;Thriller;NA;Tomás Rangel Smith;Eliane Chipia, Ana Lugosi, Michels Skwierinski
Sol Alegria;90 min;NA;Comedy;6.3;Tavinho Teixeira;Mariah Teixeira, Tavinho Teixeira, Mauro Soares, Joana Medeiros
The land of fire;NA;NA;Action;NA;Amrit Sinha, Jitendra Chauthani;Amrit Sinha, Megan Rack
Me Next;NA;NA;Drama;NA;Craig Joseph;Jason Maydew, Mandy Mohamed, Svetlana Ostrovskaja, Garnet Gabriels
LA VITA DOPO;NA;NA;Comedy;NA;Marianna Adamo;NA
Ani Maane;132 min;NA;Comedy;NA;Jay gb Patel;Shiju Kataria, Jay gb Patel
It's Hard to Be Human;75 min;NA;Drama;NA;Valerie Buhagiar;Nina Gilmour, Tom Wilson, Benjamin Muir, Deragh Campbell
Dark White House;NA;NA;Horror;NA;Lisa Wagner;Bryan Fortin, Nancy Trainer, Gerry Bonita, Ronald
Chaos;NA;NA;Horror;NA;Iran Kuykendall;NA
Heartache;NA;NA;Thriller;NA;Nicky Martin;NA
Tourism;NA;NA;Drama;6.1;Daisuke Miyazaki;Nina Endô, Sumire
Cicada Season;73 min;NA;Comedy, Crime, Thriller;NA;Jared Wardlaw;Jared Wardlaw, Alyssa Mills, John Cottingham, Kevin Shannon
Dve storony odnogo slona;NA;NA;Biography;NA;Julian Pavlov;NA
Dollar Mason;NA;NA;NA;NA;NA;Micky Satiar, Joel Quinn, Sian Headon, Andrew Reeves
Desaparecer;NA;NA;Drama;7.3;Josecho de Linares;Josecho de Linares, Tamara Casellas, Marc Homs, Elma Houghton
El-Ablah Tam-Tam;88 min;NA;Comedy;3.9;Ali Idris;Yasmin Abdulaziz, Hamdi El-Mirghani
Masha i Medved 3;NA;NA;Animation, Family;NA;NA;NA
Alone: The Sicarius Games;NA;NA;Thriller;NA;Nick Ranger;Brandon Allen, Joseph Baer, Katherine Barnard, Jackson Boomershine
EVERYONE AFRAID TO BE FORGOTTEN;53 min;NA;Music;8.6;Jonna Lee, John Strandh;Jonna Lee, Iggy Malmborg, Doron Davidson, Summer Masuda-Lideborg
Higher Methods;NA;NA;Mystery, Thriller;7.3;Nathan Suher;Kayla Caulfield, Brina, Allie Marshall, Joseph Oliveira
Io resto qua;70 min;NA;Comedy;NA;Gianluca Sia;Andrea Giuda, Stefania Mangia
Crushed Wings;NA;NA;Drama;NA;Lalit Bhusal;Jetinder Summan, Nisaro Karim, Mandy Thandi, Parvinder Nandhra
Axel der Held;90 min;NA;Drama;NA;Hendrik Hölzemann;Johannes Kienast, Christian Grashof, Emilia Schüle, Sascha Alexander Gersak
Bloeistraat 11;10 min;NA;Animation;6.2;Nienke Deutz;NA
Iruvudellava Bittu;NA;NA;Drama;NA;Kantha Kannalli;Meghana Raj, Thilak Shekar
Odnajde cie;NA;NA;Crime;4.8;Beata Dzianowicz;Ewa Kaim, Dariusz Chojnacki, Michal Zurawski, Piotr Stramowski
Class Acts;NA;NA;Comedy;NA;David Spieth;Eugenia Gonzales, Chris Korkalo, Hannah Estrella, John T. Witt
East Nashville: Somewhere Over the River;67 min;NA;Music;NA;John Hamlin;NA
The Carousel Never Stops Turning;84 min;NA;Drama, Thriller;6.8;Ismail Basbeth;Dhea Ananda, Gandhi Fernando, Natasha Gott, Karina Salim
Upstate Story;65 min;NA;Drama;9.4;Shaun Rose;Shaun Rose, Kendra Mosher, Adrianna Rose, Keenan Rose
Yu jian ni zhen hao;99 min;NA;Drama, Romance;5.1;Changwei Gu;Bai-Ke, Lyric Lan, Haiyu Zhang, Chuchu Zhou
Divaandha;NA;NA;Animation, Action, Sci-Fi;NA;Jaishankar Chigurula;NA
Uroboros;NA;NA;NA;8.0;Mariano Swi, Ricardo Raúl Abraham Poppe, Bernardo Artica, Rafael Caputo, Martín Caramés, Andrés Damonte, Gabriel De Piero, Luis Deslizzi, Cindy Dessal, Mariano Di Brico, Melina Von Hünefeld;Gastón Ares, Sebastián Ariosto, Bernardo Artica, Paula Badariotti
All Too Human;NA;NA;Drama;NA;Travis D. Brown, Mandy Stockholm;Katina Andoniadis, Tarisa Ann, Jeffrey Arrington, Glen Baggerly
Shabdam;118 min;NA;Drama;NA;P.K. Sreekumar;Linu Issac, Richard K. Joe, Sophia M. Joe, Babu Kuzhimattom
Get Hard;90 min;NA;Comedy;NA;Wai Cheong Chan;J.C. Chee, Elvis Chin, Emily Kong, Juwei Teoh
Legends of Broken Rock: Fiddle;NA;NA;Fantasy;NA;Brett Vey;Brody Andrews, Emma Bastow, Claire Collins, Shannon Collins
Destiny on the Main Stage;90 min;NA;NA;NA;Poppy de Villeneuve;NA
Spiele mit Bart: The Movie feat. Night Trap;119 min;NA;Comedy;8.9;Gregor Kartsios;Etienne Gardé, Gregor Kartsios, Simon Krätschmer, Daniel Schröckert
Mumbai Pune Mumbai 3;NA;NA;Family, Musical, Romance;NA;Satish Rajwade;Swwapnil Joshi, Mukta Barve
Clownsploitation;NA;NA;Horror;NA;Britmic, Michael Leo Centi, Debbie D, Steve Doss, Sierra Ellis, Logan Fry, Genixo, Peter Goddard, Jason Impey, Dane Keil, Alex Liakos, Sam Mason-Bell, Antoni McVay, Moses, Tony Newton, Brandon Tanczak, Alan Watkins, Graham Bowlin, Nathan Hill, John H. Shelton;Graham Bowlin, Peter Bowlin, Steven Chamberlain, Debbie D
Bondage;82 min;NA;Drama;NA;Juan Pablo Ríos;Lia Nessim Macía
Il Lungo il Corto e il Pacioccone;52 min;NA;Family;NA;Marzia Toscano;NA
Divided;19 min;NA;Drama;8.1;Cecily Vaughn;Cecily Vaughn, Gary Matthew, Tom Alper, Cord Jackman
Sanam Yeh Wada Raha;NA;NA;Family;NA;Ajay Dixit;NA
Police Junior;143 min;NA;Action, Thriller;NA;Suresh Shankar;Shanavas Shanu, Narain, Sunil Sukhada, Kanakalatha
Forty Ounces to Freedom;NA;NA;Comedy;NA;Ryan David Green;Will Benzel, Wil Wilson, Jim Ritchey, Stephen Waldrop
Divina;NA;NA;Comedy;NA;Castiglione Alberto;NA
Ohio Zombie Guard;NA;NA;Horror;NA;NA;Jason Ash, Carlos Bryant, Kc Burke, Matt Estes
Paranoia Tapes 5: Watchers;NA;NA;Horror;NA;Jack Saint Hunter;NA
Aashiq Vanna Divasam;127 min;NA;Drama, Family;6.2;Krish Kymal;Priyamani, Nasser Latif, Kalasala Babu, Ambika Mohan
Mera Javai N.R.I.;NA;NA;Family;NA;Ajay Dixit;NA
Re Raya;NA;NA;Sport;NA;Milind Shinde;Sanket Angarkar, Sanskruti Balgude, Vivek Chabukswar, Abhijeet Chavan
The Return of the Panther;NA;NA;Action;NA;Dr. Z;Mark Medeiros, Ashley Short, Nathan Young, Dr. Z
Chol Jai;114 min;NA;History;NA;Masuma Rahman Tani;Anisur Rahman Milon, Lucy Tripti Gomes, Khalid Mahbub Turjo
The Play;94 min;NA;Drama, Romance;NA;Alejandro Fernández Almendras;Elizaveta Maximová, Jirí Mádl, Marika Soposká
Waking the Wild Colonial;106 min;NA;Drama;NA;Shannon McMahon;Katherine Allentuck, Noah Bailey, Amy Brentano, Mark Byrne
Cold Pressed;90 min;NA;Thriller;NA;S. Viknesh;Michael X. Sommers, Samrat Chakrabarti, Sydney Van Delft, Kavi Ladnier
Amando a Carolina;NA;NA;Drama;NA;Martin Viaggio;Daniel Alvim, Bela Carrijo, Guillermo Pfening
I Am The Dream;NA;NA;Drama;NA;Stephen Stix Josey;Stephen Stix Josey, Dannon Green, Carl Clemons, Mike Rae Anderson
Birds of a Feather;8 min;NA;Animation, Adventure, Comedy;NA;Bianca Nall;NA
The Fiddle;NA;NA;Comedy, Crime, Drama;NA;Manjit Singh;Manjit Singh, Adam Jogee, Aryan Singh, Cameron Singh
8MM Bullet;146 min;NA;Crime;NA;Harikrishna S.;Jaggesh, Adi Lokesh, Shobraj, Vasishta N. Simha
The Family: Tales of a Gangster;NA;NA;Crime;NA;Mackey Lavond;Lavond Mackey, Morgan Barnhart, Lakiyah Mackey
Focus: A Gate Is Now Opened;NA;NA;Mystery, Thriller;NA;Christophe Lenoir;Camille Solal
Daughter of God;72 min;NA;Sci-Fi;NA;Shri Fugi Spilt;Shri Fugi Spilt, Steve Zilliax
Dog Days;124 min;NA;Drama;NA;Timmy Harn;Ybes Bagadiong, Miguel Reyes, Bie Ruaro, Charles Aaron Salazar
Segunda vez;94 min;NA;NA;NA;Dora García;NA
L'Eroe;90 min;NA;Drama;NA;Cristiano Anania;Salvatore Esposito, Marta Gastini, Vincenzo Nemolato, Paolo Sassanelli
Jionde Aan;NA;NA;Thriller;NA;Rajeev Kumar;Mahabir Bhullar, Raj Dhaliwal, Tejinder Pal Dhir
Lost in Habana;90 min;NA;Biography;NA;Dami Onifade;NA
Halcón Ciego;NA;NA;Thriller;NA;Marino Darés;Jason Matilla, Héctor Juezas, Josep Selles, Javier Rodrigo
Tari Maate Once More;158 min;NA;Drama;NA;Saurin Chaudhary;Meera Acharya, Janki Bodiwala, Bharat Chawda, Shraddha Dangar
Wherever You Are;101 min;NA;Drama;NA;Bel Bechara, Sandro Serpa;Eduardo Acaiabe, Rita Batata, Rodrigo Caetano, Samuel de Assis
Love & Drugs;NA;NA;Drama;NA;Domenique Smith, DeMarcus Bailey, Vernon Snoop Robinson;Kenny Gardner, Santosha Faulkner, Cory Espie, Raquel Belt
Rogue;NA;NA;Sci-Fi;NA;Nobuhiro Suzumura;Kensei Mikami, Yuki Ochi, Yukiaki Kiyama, Takashi Nagayama
The Night Of Prisms;52 min;NA;Drama;NA;Taylor Brown;Sarah Butler, Jessica Dupre, Mark Riley, Marcos Rodriguez
Just Remember;81 min;NA;Drama, Family, Romance;NA;Tianna Banton;Nicola Wright, Yousuf Emrani, Desirée M. Jakobs, Paul Stephen Lambeth
Where did I go wrong, what did I Wrong?;NA;NA;Drama;NA;Oliver Marsden;NA
December tale or S.Mykolay's Adventures;90 min;NA;Comedy;NA;Semyon Gorov;Przemyslaw Cypryanski, Mariya Efrosinina, Andrey Kronglevskiy, Tetyana Lavrushko
Always Live Laugh Love;NA;NA;NA;NA;Le Ann Cheri', C. Michael Palomba, Gerard Lima;Gerard Lima, Jimmy Manfredy, Jenifer Day, Maria LaVee
Lake House Whisper;55 min;NA;Thriller;NA;NA;Mark Haggett, Dave Allen, William Variz, Sydney Atkin
The Graveless Earth;NA;NA;Action, Drama, War;NA;NA;NA
The Goose;72 min;NA;Drama;6.0;Mike Maryniuk;Rob Crooks, Bea Solsberg, Washboard Hank, Rob Vilar
Nachtmahr;8 min;NA;Animation, Comedy, Mystery;NA;Ana Maria Angel;NA
Ci vuole un fisico;NA;NA;Comedy;NA;Alessandro Tamburini;Anna Ferraioli Ravel, Alessandro Tamburini
Resolution Song;93 min;NA;Drama, Family;8.5;Antonio James;Torrei Hart, Sean McNabb, Lester Speight, Ella Joyce
Faith;NA;NA;Drama;NA;Rhys Horler;Rhys Horler, Yasmin Bird
Clowns & Robbers;87 min;NA;Adventure, Comedy, Crime;8.6;Evan Falbaum;Kemerton Hargrove Jr., Mitch Landry, Erica Callais, Thomas Avallone
Bappa Vinayak;NA;NA;Comedy;NA;NA;NA
La Redención;NA;NA;History;8.5;NA;Juan Carlos Notari, Lali Gonzalez, José Barrios, Sergio Cardozo
Love, Unemployed;95 min;NA;Drama;NA;Ricky Wong;Kade Alexander, Luthor Bangert, Ana Cardoso, Hannah Clark
Aedan: Garden of Desire;130 min;NA;Drama, Fantasy, Mystery;5.5;Sanju Surendran;Abhilash Nair, Nandini Sree, Prasant M. Madathilkarottu, Sunny Alias Torappan Bastian
friEnD ADd 6;67 min;NA;Comedy, Fantasy, Horror;NA;Dean Littner;Dudley Beene, Jules Bernstein, Cannon Ball Buckley, John Cantwell
Wine to love;NA;NA;Comedy;NA;Domenico Fortunato;Domenico Fortunato, Alessandro Intini, Ornella Muti, Katsiaryna Shulha
Ashes;90 min;NA;Drama;NA;Neriah Kharece;Katy Key, Tristan Riggs, Devin McGregor Ketko, Ven Scott
House of Serenity;98 min;NA;Drama;NA;Cafer Özgül;NA
Jai Shree Daam;NA;NA;Comedy;NA;Biplop Upreti;Amrit Dhungana, Jebica Karki
Cascos indomables;84 min;NA;Drama;5.0;Ernesto Villalobos;Daniela Mora, Harvey Monestel, Arturo Pardo, Janko Navarro
Caiga quien caiga;NA;NA;Thriller;5.4;Eduardo Guillot;José Miguel Arbulú, Eduardo Camino, Miguel Iza
Fly by Night;NA;NA;Crime, Drama;NA;Jimmy Naples, Nate Shively;Beshoy Hanna, Matthew Divis, Nonie Shiverick, Lauren Odioso
Sotka;92 min;NA;Comedy;7.8;Alexander Beliak;Evgeniy Kaporin, Ieva Andrejevaite, Dmitriy Tsynkovskiy, Mikhail Bogdasarov
Toof;NA;NA;Horror;NA;Louisa Warren;Claire-Maria Fox, Claudine-Helene Aumord, Manny Jai Montana, Clayton Frake
In the Orchard;102 min;NA;Drama;8.7;Christopher Knoblock;Jonas Ball, Pamela Gray, Christopher Knoblock, Jack McGee
Traces of Indignity;NA;NA;Drama;NA;Renee Williams;Kris Lloyd, Michelle Sanford, Jessica Osborn, Pamela Ricardo
Following Phil;90 min;NA;Drama, Family;NA;Samuel Omole;Jiree Jillyan Jones, Nicolas Cruz, Robyn Elise, Lydia McElderry
Vadkanvadászat;60 min;NA;History;NA;Róbert Pajer;Tamás Puskás, Szabolcs Bede Fazekas, Lajos Kovács, Antal Cserna
Aru Zonbi Shoujo no Sainan;79 min;NA;Animation;5.3;Hideaki Iwami;Saori Hayami, Mao Ichimichi, Yurika Kubo, Takahiro Miwa
Conejos Asesinos;NA;NA;Thriller;NA;Felipe Tellez;Darell M. Davie, Iván Cruz, Azul Abril, Bianca Hernandez
Diciembres;NA;NA;Drama;7.4;Enrique Castro Ríos;Delicia de Montañez, Jeronimo Henao, Luis Juliao, Carlos Alfredo Lopez
Sobre los Muertos;68 min;NA;Fantasy;NA;Simón Vargas;Daniel Antivilo, Catalina González, Nicolás Zárate
Immigrant;NA;NA;Crime, Drama;NA;Harprit Dhanoa;Sami Karim, Gareth Lawrence, Rachel Loughran, Wesley Magee
Gabriel;NA;NA;Drama;NA;Nuno Bernardo;Igor Regalla, José Condessa, Ana Marta Ferreira, Mina Andala
Krishnatulasi;134 min;NA;Comedy, Drama, Romance;8.5;Sukhesh Nayak;Ramesh Bhat, Meghashree, Tabla Nani, Kuri Prathap
Corsario;67 min;NA;Drama;NA;Raúl Perrone;Martin Bermello, Alejandro Ricagno, Nicolas Ruiz
1940;15 min;NA;Drama, History, War;NA;Joe Morley;Siobhan Bermingham, Colin Braysher, Sian Francis, Ben Everett Riley
An Unpleasant Surprise;7 min;NA;Horror;8.4;James Furlong;Joshua Lee Young, David Witts, Tim Crowe, Tatevik Hunanyan
Kanchhi;NA;NA;Romance;NA;Akash Adhikari;Kameshwor Chaurasiya, Shweta Khadka, Binod Neupane, Dayahang Rai
Baiorêtâ;NA;NA;Horror;NA;Jun'ichi Yamamoto;Mai Arai, Shinichi Fukazawa, Shun Kitagawa, Shinji Kubo
La noche nos lleva;NA;NA;Drama;NA;David González Rudiez;Carlos Algaba, Luis Alonso, Cruz López-Cortón, Soraya Peña
Tut Yüregimden Anne;90 min;NA;Drama;4.2;Burçin Aydin, Bülent Aydogan;Naz Elmas, Sermiyan Midyat, Ela Sen, Janberk Nak
Larmes en cendre;NA;NA;Drama;NA;William Cantin, Andrew Cyr-Marcoux;William Cantin, Andrew Cyr-Marcoux, Judy Harvey
I bambini della Grande Guerra;108 min;NA;History;NA;Alessandro Bettero;NA
Stick Therapy;117 min;NA;Comedy;NA;George Bearpark;Mike Cottrell, Sarah Divall, James Forster, Joseph James
Liquid Love;NA;NA;Drama;NA;Vítor Steinberg;Sephora Venites, Paula Liberati
Wo yao jing jing;NA;NA;Comedy;NA;Hong Lin;Zhenghong Guo, Shen Lin, Di Wu
The Big Day;88 min;NA;Comedy, Romance;8.1;Thean-jeen Lee;Amber An, Geraldine Gan, Michael Huang, Ling Ling Liu
Seven Hundred Miles;95 min;NA;Adventure, Comedy, Drama;NA;Cameron Bishop, Carlos Enrique Tejera;Kwaku El, Cameron Bishop, Cason Day, Carlos Enrique Tejera
No Where, Now Here;89 min;NA;Drama, Romance;NA;Kah-Wai Lim;Ferdi Lutviji, Nurdan Lutviji, Dejan Pesic, Anja Kyrmyza
Safe Neighborhood;100 min;NA;Thriller;NA;Joseph Jones;Cathalina Benavente, Abby Borja, Hailee Borja, Joseph Jones
Santhoshathil Kalavaram;130 min;NA;Horror, Thriller;NA;Kranthi Prasad;Niranth, Rudra Aura, Aaryan, Ravi Mariya
Padi Padi Leche Manasu;NA;NA;Romance;NA;Hanumantha Rao Raghavapudi;Sharvanand, Sai Pallavi, Priya Raman, Vennela Kishore
Camp Apparition;80 min;NA;Horror;NA;Michael Page;Michael Page, Johnny Ray Gibbs, Jay Dobyns, Kelly Kotlarz
Z-Fury;NA;NA;Action, Horror;NA;Zainal Palmans;Wouter Wieringa, Anna Bontekoe, Patricia Bisschop, Nathan Moorrees
Dodging the Bullet;NA;NA;Action, Adventure, Comedy;NA;Josh Luckett, Josh S. Phillips;Anthony M. Panzeca, Sophia Manyet, Ted Stratton, Robert Lamar Burns
Bende Kal;90 min;NA;Comedy;5.9;Utku Uçar;Peker Açikalin, Sadi Celil Cengiz, Hüseyin Elmalipinar, Emin Gümüskaya
Fatal Future;93 min;NA;Adventure, Comedy, Sci-Fi;6.8;Sean Doyle, Michael Keene;Michael Keene, Bri Ana Wagner, Ivy Salazar, Alex Pusineri
I've Been Thinking;NA;NA;Comedy;NA;Natalie Simpkins;Alec Gaylord, Ben Kawaller, Chris Schermerhorn
Robin Hood: The Legend Begins;90 min;NA;NA;NA;Jake C. Young;Jeremy Boggs, Mark Isham, Merlin Napier III, Brianna Phipps
Soldier's Joy;NA;NA;Drama, Romance, War;NA;Danny Lee Ramsey;Denise Johnson, Richard Leo Hunt, Joshua James Johnson, James Stokes
Hosa Prem;135 min;NA;Comedy, Romance;8.8;Pramod Sahoo;Shree Brojen Bora, Kalpa Jyoti Gogoi, Tapashree Kalita, Manas Sarma
The Run;NA;NA;Action;NA;Michael Aguiar;NA
Bruises;92 min;NA;Drama;NA;Vince Gade;Victor Ade, Selom Awadzi, Vaiva Botyriute, Ray Calleja
You, Your, Yours;104 min;NA;Drama, Romance;NA;Daigo Matsui;Sôsuke Ikematsu, Kkobbi Kim, Shinnosuke Mitsushima, Osamu Mukai
Remote Viewing;NA;NA;Mystery;NA;Stuart Paul;Sarah Agor, Stuart Paul, Tim Dax, Karoly Bieganowski
The Motorbike aka Motorut;83 min;NA;Drama, Romance;4.7;Valentin Goshev;Alexandra Rasicheva, Dimitar Angelov, Rudy Evtimov, Nikola Dodov
Cash hai to aish hai;NA;NA;Comedy;NA;Manish Vatsalya;Yuvika Chaudhry, Sheena Lakhani, Hemant Pandey, Jimmy Sheirgill
Sunny;155 min;NA;Drama;NA;Usman Taiwo;Britney Jones, Tyra Smith, Usman Taiwo
Deep of the Sea;NA;NA;Action, Fantasy, Romance;NA;Adam Vera;Noel Ramos, Allie Marshall, Joseph Oliveira, Hannah Heckman-McKenna
Cold Soldiers;101 min;NA;Action;NA;Nick Smith;R.W. Smith, Trevor Erickson, Sandra Elise Williams, Michael Easler
Pari Hoon Main: i'm a fairy;110 min;NA;Drama, Family;NA;Rohit Shilwant;NA
Life: Amidral;104 min;NA;Drama;NA;Janchivdorj Sengedorj;Navchaa Bazarjav, D. Purevsuren, Bold-Erdene Sugar
Das Milan-Protokoll;100 min;NA;Drama, Thriller, War;6.2;Peter Ott;Catrin Striebeck, Christoph Bach, Samy Abdel Fattah, Bengin Ali
Psychopath;NA;NA;Horror;NA;Tracy Jones;Jeremy Ghali, Chris Charteris, Paul Tucker, Cinnamon Smith
Roja Oscuridad;95 min;18;Crime, Horror, Mystery;NA;Chris Jiménez;Fátima Martín Acosta, Belén Caravaca, José Conesa, Raquel D'Ambrosio
Jurica Road;120 min;NA;Drama, Thriller;NA;Don Okolo;Dominic Pace, Johnny Ray Gibbs, Carl Bailey, Lisa Mcconnell
Kapidaki Sir;NA;NA;Horror, Thriller;6.7;Mehmet Ali Zaim;Natali Kayova, Melek Orhanoglu, Asuman Zaim, Siar Zaim
Rajasimha;NA;NA;Action;NA;Ravi Ram;Ambarish, Aniruddha, Vijay Chendur, Sharath Lohitashwa
This Side of the Dirt;90 min;NA;Comedy, Drama;NA;Ty Roberts;Jonna Juul-Hansen, Beth Shea, Wray Crawford, Mark A. Hernandez
