title;duration;certificate;genre;rating;directors;stars
#Selfi;112 min;NA;Thriller;5.2;Nikolay Khomeriki;Konstantin Khabenskiy, Yuliya Khlynina, Mariya Serova, Anna Mikhalkova
This Week at the Comedy Cellar (TV);30 min;NA;Comedy;NA;NA;NA
Voyna Anny;74 min;NA;Drama;7.1;Aleksey Fedorchenko;Marta Kozlova, Ilya Belov, Sergey Fedorov, Konstantin Itunin
Fourplay;77 min;NA;Comedy, Drama;7.5;Dean Matthew Ronalds;Tammy Blanchard, Bryan Greenberg, Dominic Fumusa, Emanuela Galliussi
Haathi Mere Saathi;NA;NA;Fantasy;NA;Prabu Solomon;Kalki Koechlin, Vishnu Vishal, Rana Daggubati, Zoya Hussain
Loss Prevention;NA;NA;Action;9.1;Brian Cunningham, Matt Niehoff;Abisha Uhl, Sebrina Scott, James Tackett, Shawn Taiwone Francis
Ani... Dr. Kashinath Ghanekar;NA;NA;Drama;9.0;Abhijeet Deshpande;Subodh Bhave, Nandita Dhuri, Anand Ingle, Mohan Joshi
MUDRA;NA;NA;Crime;NA;T.N. Santhosh;Vennela Kishore, Nikhil Siddharth, Lavanya Tripathi
Göktasi;NA;NA;Comedy;2.6;Caner Erzincan;Safak Sezer, Ayhan Tas, Bülent Çolak, Tuna Orhan
Jules of Light and Dark;NA;NA;NA;7.7;Daniel Laabs;Tallie Medel, Robert Longstreet, Betsy Holt, Jonathan Miles Howard
Korô no chi;126 min;NA;Crime, Drama;7.1;Kazuya Shiraishi;Kôji Yakusho, Junko Abe, Yôsuke Eguchi, Gorô Ibuki
Bride of Scarecrow;NA;NA;Horror;2.8;Louisa Warren;Claire-Maria Fox, Manny Jai Montana, Claudine-Helene Aumord, Karin Bello
Raju Gadu;130 min;NA;Family;6.5;Sanjana Reddy;Krishna Bhagavan, Amyra Dastur, Raghu Kumar Karumanchi, Khayyum
Ni Tú Ni Yo;98 min;NA;Comedy;4.7;Noé Santillán-López;Alfonso Herrera, Bárbara de Regil, Rocío Verdejo, Alejandro Calva
Mission Possible;NA;NA;Adventure, Comedy, Family;5.8;Bret Roberts;John Savage, James Duval, Blanca Blanco, Chris Coppola
Head Count;90 min;NA;Horror, Mystery, Thriller;7.1;Elle Callahan;Isaac Jay, Ashleigh Morghan, Bevin Bru, Tory Freeth
Happy Face;100 min;NA;Drama;8.4;Alexandre Franchi;Robin L'Houmeau, Debbie Lynch-White, David Roche, E.R. Ruiz
Rashtraputra;122 min;NA;Action, Biography, Drama;6.3;Aazaad;Aazaad, Rakesh Bedi, Abhay Bhargav, Manish Chaudhary
In Searching;90 min;NA;Adventure, Drama, Western;NA;J.L. Topkis;Jake Borelli, Jacob Grodnik, Aley Underwood, Evan Hall
The Maestro;94 min;NA;Biography, Drama, History;9.1;Adam Cushman;Xander Berkeley, Sarah Clarke, Kristen Gutoskie, Bobby Campo
Love Me Anyway;77 min;NA;Drama, Romance;4.7;Ryan Balas;Daniel Armando, Dee Herlihy, Edgar Muñiz, Melissa Navia
BROS. Last Call;NA;NA;Comedy;9.7;Don Tjernagel;Don Tjernagel, Jeremy Milks, Cassie O'Meara, Matt Lee Ingebritson
Watchman;90 min;NA;Comedy, Drama, Fantasy;6.7;Durmus Akbulut;Koray Ergun, Pelin Ermis, Ugur Karabulut, Serhan Süsler
Sketch;137 min;NA;Action;5.9;Vijay Chandar;Vikram, Tamannaah Bhatia, Sriman, Soori
Sakamichi no Apollon;120 min;NA;Drama;7.2;Takahiro Miki;Yuri Chinen, Dean Fujioka, Nana Komatsu, Erina Mano
Nolok;NA;NA;Comedy, Romance;NA;Rashed Raha;Shakib Khan, Eamin Haque Bobby, Rajatabha Dutta, Tariq Anam Khan
30 Miles from Nowhere;NA;NA;Thriller;NA;Caitlin Koller;Carrie Preston, Rob Benedict, Rusty Schwimmer, Cathy Shim
Horror and Hamsters;82 min;NA;Comedy;5.0;April Campbell, Randy Smith;Ray Besharah, Victoria Luloff, Stephanie Moran
The Wishing Forest;NA;NA;Fantasy;2.7;Jadzia Perez, Leia Perez;Karin Brauns, Robert Amstler, Samuel Story, Stormi Maya
Katafigio II: The Ice Path;80 min;NA;Horror, Thriller;7.3;Hristos Nikoleris;Kika Zachariadou, Viky Maidanoglou, Yiorgos Spanias, Aris Antonopoulos
The Sonata;NA;NA;Mystery, Thriller;NA;Andrew Desmond;Rutger Hauer, James Faulkner, Freya Tingley, Simon Abkarian
Inspector Gullu;NA;NA;Action;7.1;Aziz Naser;Adnan Sajid Khan, R.K. Mama, Aziz Naser
Njan Prakashan;NA;NA;Drama;NA;Sathyan Anthikad;Fahadh Faasil, Sreenivasan, Nikhila Vimal, Aneesh Menon
GujjuBhai: Most Wanted;157 min;NA;Comedy;7.5;Ishaan Randeria;Siddharth Randeria, Jimit Trivedi, Anil Charanjeett, Alok Gagdekar
Son Çikis;NA;NA;Comedy, Drama;6.6;Ramin Matin;Deniz Celiloglu, Gizem Erdem, Tekin Ezgütekin, Kerem Firtina
La dernière folie de Claire Darling;94 min;NA;Drama;7.0;Julie Bertuccelli;Catherine Deneuve, Chiara Mastroianni, Alice Taglioni, Laure Calamy
Skin Creepers;NA;NA;Comedy, Fantasy, Horror;6.9;Ezra Tsegaye;Mai Duong Kieu, Barbara Prakopenka, Milton Welsh, Micaela Schäfer
Gekijô-ban Kamen Raidâ Birudo: Bî Za Wan;66 min;NA;Action;8.1;Kazuya Kamihoriuchi;Atsuhiro Inukai, Kaho Takada, Eiji Akaso, Kôhei Takeda
If You're Gone;NA;NA;Drama;NA;Brittany Goodwin;Masey McLain, Desiree Ross, Ben Davies, Burgess Jenkins
Junga;156 min;NA;Action, Comedy;5.4;Gokul;Vijay Sethupathi, Sayyeshaa Saigal, Madonna Sebastian, Suresh Chandra Menon
Jack Hardy's Guide to Blackjack;37 min;NA;Drama, Fantasy;NA;David Dufour;Kwinn Varney, Aimee DuMars, Chris Redish, Sarah Ann Leslie
Cry No Fear;105 min;NA;Thriller;7.9;Richard Somes;Ella Cruz, Donnalyn Bartolome, Lito Pimentel, Christopher Roxas
Direnis Karatay;118 min;NA;Action, History, Thriller;7.5;Selahattin Sancakli;Mehmet Aslantug, Fikret Kuskan, Yurdaer Okur, Alperen Duymaz
Nightshooters;NA;NA;Action;NA;Marc Price;Jean-Paul Ly, Doug Allen, Rosanna Hoult, Nicholas Aaron
Ten Years Thailand;95 min;NA;Drama;2.7;Aditya Assarat, Wisit Sasanatieng, Chulayarnnon Siriphol, Apichatpong Weerasethakul;NA
My 2 Mommies;102 min;NA;Comedy;5.4;Eric Quizon;Paolo Ballesteros, Solenn Heussaff, Maricel Soriano, Joem Bascon
Vedigundu Pasangge;136 min;NA;Comedy, Crime, Drama;8.4;Vimala Perumal;David Anthony, Sugumaran Asugan, Krishan Bahadur, Kalaivani Dharmarajee
Bizli: Origin;124 min;NA;Action, Fantasy, Sci-Fi;7.7;Iftakar Chowdhury;Eamin Haque Bobby, Zahid Hasan, Ilias Kanchan, Raanveer
Charlotte a du fun: Charlotte has fun;89 min;NA;Comedy;6.9;Sophie Lorain;Marguerite Bouchard, Romane Denis, Rose Adam, Alex Godbout
The Decadent and Depraved;NA;NA;Action, Adventure, Comedy;7.7;Axel August, Jordon Prince-Wright;Michael Muntz, Ben Mortley, Steve Turner, Clarence Ryan
Kohi ga Samenai Uchi Ni;NA;NA;Adventure, Sci-Fi;7.1;Ayuko Tsukahara;Kasumi Arimura, Motoki Fukami, Haru, Kento Hayashi
Chalbaaz;152 min;NA;Comedy, Drama;8.4;Joydip Mukherjee;Atul Sharma, Subhasree Ganguly, Charlotte Dunnico, Ashish Vidyarthi
Best Mom;NA;NA;Comedy;NA;Kuang Lee;Krista Allen, Donna Mills, Beth Curry, Violet Hicks
Officer;122 min;NA;Action;3.7;Ram Gopal Varma;Nagarjuna Akkineni, Myra Sareen, Feroz Abbasi, Ajay
Camp Hideaway Massacre;87 min;NA;Horror;4.2;Skip Bizr, Ted Moehring;Lerch Buckler, Morgan Curry, Walter Curry, Haley Dittrich
The Redeeming;85 min;NA;Drama, Mystery, Thriller;4.1;Brian Barnes;Robert Blackwood, Robert Coren, Ryan Wichert, Tracey Ann Wood
White Rabbit;71 min;NA;Comedy, Drama;6.6;Daryl Wein;Vivian Bang, Nico Evers-Swindell, Nana Ghana, Tracy Hazas
Oru Kuppai Kathai;135 min;NA;Drama;6.5;Kaali Rangasamy;Dinesh, Manisha Yadav, Yogi Babu, Aadhira Pandilakshmi
Kamerdyner;150 min;NA;Drama, History, Romance;6.3;Filip Bajon;Janusz Gajos, Anna Radwan, Sebastian Fabijanski, Marianna Zydek
Les confins du monde;103 min;NA;Drama, War;7.1;Guillaume Nicloux;Gaspard Ulliel, Guillaume Gouix, Lang Khê Tran, Gérard Depardieu
Norske byggeklosser;99 min;NA;Comedy;6.0;Arild Fröhlich;Atle Antonsen, Anders Baasmo Christiansen, Anne Marit Jacobsen, Ine F. Jansen
Last Summer;97 min;NA;Drama;NA;Jon Jones;Noa Thomas, Gruffydd Weston, Rowan Jones, Christopher Benning
When It Comes Around;90 min;NA;Drama, Romance;4.3;Dan Garcia;Alex Gibbs, Denyce Lawton, Brad James, Jackée Harry
Gags;89 min;NA;Comedy, Horror;7.6;Adam Krause;Lauren Ashley Carter, Tracy Perez, Aaron Christensen, Evan Gamble
Epidemic;71 min;NA;Horror;2.5;Stephen Michael Giglio;Amanda K. Morales, Mike Sutton, Gina Destra, Andrew Hunsicker
King of Boys;169 min;NA;Drama;9.5;Kemi Adetiba;Sola Sobowale, Remilekun Reminisce Safaru, Adesua Etomi, Paul Sambo
Zoo Wars;70 min;NA;Animation;4.3;NA;Bobbi Maxwell, Bill Oberst Jr., Kj Schrock
Bebek Geliyorum Demez;NA;NA;Comedy;7.7;Hakan Ciga;Basak Parlak, Ali Il, Cezmi Baskin, Seray Gözler
Sumaho o Otoshita dake;NA;NA;Drama, Mystery, Thriller;6.0;Hideo Nakata;Keiko Kitagawa, Yûdai Chiba, Ryô Narita, Kei Tanaka
Point Man;107 min;NA;Action;9.4;Phil Blattenberger;Jimmy Ace Lewis, Joshua Dela Cruz, Marianne del Gallego, Adam Brudnicki
Mein Bruder heißt Robert und ist ein Idiot;174 min;NA;Drama;5.1;Philip Gröning;Josef Mattes, Julia Zange, Urs Jucker, Stefan Konarske
Naachiyar;100 min;NA;Action, Drama, Thriller;6.9;Bala;Jyothika, G.V. Prakash Kumar, Rockline Venkatesh
Tolko ne oni;90 min;NA;Comedy;2.9;Aleksandr Boykov;Sergey Belogolovtsev, Denis Buzin, Aleksey Dmitriev, Sergey Dubrov
Para Aduma;90 min;NA;Drama;6.2;Tsivia Barkai;Avigail Kovari, Gal Toren, Moran Rosenblatt, Dana Sorin
Granny Shot;81 min;NA;Comedy;8.5;Michael Hickey;Dan Brown, Elizabeth Stenholt, Tyler Evans, Tyler Burke
Did I Kill My Mother?;90 min;NA;Mystery;5.4;David Bush;Megan Park, Austin Highsmith, Dane Rhodes, John Ceallach
Love for Sale;NA;NA;Drama;7.8;Andibachtiar Yusuf;Gading Marten, Della Dartyan, Verdi Solaiman, Adriano Qalbi
The Flip Side;90 min;NA;Comedy, Romance;5.2;Marion Pilowsky;Eddie Izzard, Vanessa Guide, Tina Bursill, Hugh Sheridan
Samhain: A Halloween Horror Movie;80 min;NA;Horror;2.8;Joe Gray;Michelle Morocco, Drew Schrum
Quanto basta;92 min;NA;Comedy;6.2;Francesco Falaschi;Vinicio Marchioni, Valeria Solarino, Luigi Fedele, Nicola Siri
The Perfect Pickup;NA;NA;Comedy;6.6;Chad Rook;Chad Rook, Nathan Witte, Derek Gilroy, Jaime M. Callica
Khajoor Pe Atke;119 min;NA;Comedy;5.4;Harsh Chhaya;Vinay Pathak, Suneeta Sengupta, Alka Amin, Manoj Pahwa
Gultoo;128 min;NA;Crime, Drama;8.6;Janardhan Chikkanna;Naveen Shankar, Sonu Gowda, Avinash, Rangayana Raghu
Inttelligent;130 min;NA;Action, Drama;2.6;Vinayak V.V.;Sai Dharam Tej, Lavanya Tripathi, Mahesh Achanta, Siva Akula
Sunrise in Kimmeria;100 min;NA;Comedy;8.1;Simon Farmakas;Tim Ahern, Constantinos Alkiviades, Athos Antoniou, Peter Brooke
La reina del miedo;107 min;NA;Drama;6.7;Valeria Bertuccelli, Fabiana Tiscornia;Valeria Bertuccelli, Gabriel Goity, Darío Grandinetti, Anders Hvidegaard
Kucumbu tubuh indahku;105 min;NA;Drama;6.3;Garin Nugroho;NA
Les;97 min;NA;Drama;NA;Roman Zhigalov;Oleg Shibayev, Natalya Rychkova, Ildar Allabirdin, Mariya Avramkova
Kuso yarô to utsukushiki sekai;NA;NA;Drama;5.5;Naruhiro Gonpa, Yûichi Kodama, Kenjirô Sano, Sion Sono, Taku Tada, Kenji Yamauchi, Takaaki Yamazaki, Hikari Ôta;Shinnosuke Mitsushima, Machiko Ono, Fumika Baba, Gorô Inagaki
The Albanian Recruit;72 min;NA;Crime, Drama;NA;Sunaj Raca;Edon Mulaj, Bekim Mulaj, Don Raca, Sunaj Raca
Vadhayiyaan Ji Vadhayiyaan;122 min;NA;Comedy;7.1;Smeep Kang;Binnu Dhillon, Kavita Kaushik, Karamjit Anmol, Gurpreet Ghuggi
Haami;133 min;NA;Drama;8.2;Shiboprosad Mukherjee, Nandita Roy;Broto Banerjee, Tiyasha Pal, Aparajita Adhya, Masood Akhtar
Asuravadham;NA;NA;Action;6.1;Maruthupandian;M. Sasikumar, Nandita Shwetha
818;NA;NA;Drama;NA;Chris Gehrt, Joe Hackett, Joe Taylor;Jason James Richter, Tim DeZarn, Elizabeth De Razzo, Kika Magalhães
Una Mujer Sin Filtro;90 min;NA;Comedy;4.9;Luis Eduardo Reyes;Fernanda Castillo, Alejandro Calva, Flavio Medina, Mariano Palacios
Rang Panjab;NA;NA;Crime, Drama, Romance;NA;Rakesh Mehta;Deep Sidhu, Reena Rai, Hobby Dhaliwal, Gurjit Singh
Ma mère est folle;NA;NA;Comedy;NA;Diane Kurys;Fanny Ardant, Arielle Dombasle, Patrick Chesnais, Vianney
Mon tissu préféré;96 min;NA;Drama;3.8;Gaya Jiji;Metin Akdülger, Manal Issa, Gaya Jiji, Ula Tabari
Sinterklaas en de wakkere nachten;NA;NA;Comedy, Family;6.8;Stijn Coninx;Warre Borgmans, Evelien Bosmans, Jan Decleir, Els Dottermans
Softness of Bodies;NA;NA;Comedy;2.4;Jordan Blady;Dasha Nekrasova, Morgan Krantz, Lena Reinhold, Nadine Dubois
The Maid in London;140 min;NA;Drama;NA;Danilo Ugali;Andi Eigenmann, Matt Evans, Polo Ravales, Alexis Navarro
Tujuh Bidadari;90 min;NA;Horror;NA;Muhammad Yusuf;Dara Warganegara, Lia Waode, Brigitta Cynthia, Gabriella Desta
Coureur;96 min;NA;Drama;8.1;Kenneth Mercken;Fortunato Cerlino, Nicola Rignanese, Karlijn Sileghem, Koen De Graeve
Hmyz;98 min;NA;Animation, Comedy, Drama;6.2;Jan Svankmajer;Jirí Lábus, Pavel Nový, Norbert Lichý, Jan Budar
Redemption Of A Dogg (A Stageplay);NA;NA;Musical;NA;Je'Caryous Johnson;Eric Benét, Tamar Braxton, Omar Gooding, Lil J.J.
Far til fire i solen;90 min;NA;Family;4.0;Martin Miehe-Renard;Laura Lavigné Bie-Olsen, Martin Brygmann, Maria Erwolter, Jannie Faurschou
Le gendre de ma vie;NA;NA;Comedy;NA;François Desagnat;Kad Merad, Pauline Etienne, Julie Gayet, François Deblock
Kabir Azabi;NA;NA;Horror;4.2;Arkin Aktaç;Hakan Özgömeç, Ebru Saçar, Özlem Baskaya, Çagatay Keçeci
Hedefim Sensin;NA;NA;Comedy;NA;Kivanç Baruönü;Ata Demirer, Demet Akbag, Salih Kalyon, Gonca Vuslateri
The Faith Club;NA;NA;Family;5.6;Mark Hannah;Timothy E. Goodwin, Aaron Mees, Wade Everett, Richard Pryor Jr.
Elves;NA;NA;Horror;NA;Jamaal Burden;Deanna Grace Congo, Lisa May, Amy Jo Guthrie, Stephanie Marie Baggett
Walwal;103 min;NA;Drama;8.7;Jose Javier Reyes;Elmo Magalona, Kiko Estrada, Donny Pangilinan, Jerome Ponce
Ezhumin;110 min;NA;Action;8.2;NA;Devayani, Vivek
Mr. Invincible;95 min;NA;Comedy;NA;Vijay Rajan, Halfdan Hussey;Jordan Ray Fox, Alyson Stoner, Bill Engvall, Emilia Ares
The Dark Kingdom;NA;NA;Adventure;NA;Simon Wells;Ross O'Hennessy, Ben Loyd-Holmes, Rebecca Dyson-Smith, Zara Phythian
Hooligan Escape The Russian Job;79 min;NA;Crime;3.4;Nicholas Winter;Ali Bastian, Charlie Wernham, James Tratas, Ben Freeman
The Portuguese Kid;NA;NA;Comedy;5.3;David Horn;Jason Alexander, Pico Alexander, Aimee Carrero, Sherie Rene Scott
Lola y sus hermanos;NA;NA;Comedy, Drama;NA;Jean-Paul Rouve;Ludivine Sagnier, José Garcia, Jean-Paul Rouve, Ramzy Bedia
Nisekoi;NA;NA;Comedy, Drama, Romance;NA;Hayato Kawai;Ayami Nakajô, Haruka Shimazaki, Marika Matsumoto, Kaede Aono
The Waiter;104 min;NA;Mystery;7.1;Steve Krikris;Aris Servetalis, Yannis Stankoglou, Alexandros Mavropoulos, Eleana Finokalioti
Cheese in the Trap;116 min;NA;Romance;5.8;Je-Yeong Kim;Deok-hyeon Jo, Hyun-Jin Kim, Hye-mi Na, Jong-Hyuk Oh
23:59: The Haunting Hour;NA;NA;Horror;4.2;Gilbert Chan;Richie Koh, Mark Lee, Wang Lei, Melody Low
Shopkins Wild;72 min;NA;Animation;5.3;Richard Bailey, Adele K. Thomas;Ryan Bartley, Allegra Clark, Rebecca Davis, Jackie Lastra
Asylum of Fear;79 min;NA;Horror, Mystery, Thriller;3.6;Craig Deering;Maurice Demus, Michael Medford, Callie Deering, Allen Murphy
Gang Stalking;NA;NA;Thriller;NA;Travis Clinton Lipski;C.J. Stussi, Leo Ramsey, Ryan Singer, Chris Carlin
Omotenashi;96 min;NA;Drama;7.3;Jay Chern;Munetaka Aoki, Mina Fujii, Kyôko Kagawa, Tae Kimura
Lake of Shadows;NA;NA;Horror;7.3;Michael S. Rodriguez;McKayla Aaron, Marv Blauvelt, D.T. Carney, Geovonna Casanova
Planeta Singli 2;NA;NA;Comedy, Romance;6.1;Sam Akina;Agnieszka Wiedlocha, Maciej Stuhr, Danuta Stenka, Piotr Glowacki
Sid & Aya: Not a Love Story;94 min;NA;Drama;6.8;Irene Villamor;Anne Curtis, Dingdong Dantes, Gabby Eigenmann, Cholo Barretto
Bücür;NA;NA;Comedy;6.2;Umut Kirca;Berat Efe Parlar, Seren Sirince, Seçkin Özdemir, Taner Barlas
Saat Din Mohabbat In;138 min;7;Comedy, Romance;5.9;Meenu Gaur, Farjad Nabi;Rimal Ali, Hina Dilpazir, Amna Ilyas, Emmad Irfani
Marilyn Monroe Back?;NA;NA;Romance;NA;NA;Erika Eleniak
Bizi Hatirla;NA;NA;Drama;NA;Çagan Irmak;Altan Erkekli, Tolga Tekin, Özge Özberk, Binnur Kaya
Guy;101 min;NA;Comedy, Drama, Music;6.9;Alex Lutz;Alex Lutz, Tom Dingler, Pascale Arbillot, Nicole Calfan
The Second Sun;90 min;NA;Drama;NA;Jennifer Gelfer;Eden Epstein, John Buffalo Mailer, Ciaran Byrne, Claudia Maree Mailer
Keyboard Warriors;100 min;NA;Comedy, Crime, Drama;NA;Ho-Ching Sit;Stephy Tang, Grace Chan, Yiu-Sing Lam, Hawk Sau Yau
Let Me In 2;NA;NA;Horror;NA;James Trimboli;James Trimboli, Jane Pascoe, Rosheen McKell, Amie Bransgrove
Aschhe Abar Shabor;128 min;NA;Action, Crime, Thriller;6.2;Arindam Sil;Saswata Chatterjee, Subhrajit Dutta, Gaurav Chakrabarty, Indraneil Sengupta
Veerey Ki Wedding;131 min;NA;Comedy, Romance;3.1;Ashu Trikha;Pulkit Samrat, Jimmy Sheirgill, Kriti Kharbanda, Satish Kaushik
Vermilion;92 min;NA;Drama;NA;Dorthe Scheffmann;Fasitua Amosa, Emily Campbell, Goeretti Chadwick, Isobel Dryburgh
Demon Eye;NA;NA;Horror;NA;Ryan Simons;Darren Day, Liam Fox, Kate James, Ellie Goffe
CICADA!;82 min;NA;Comedy;NA;David Willis;David Aguilera, Nathan Alexander, Andrew Amicangelo, Nicole Anthony
Rottentail;NA;NA;Comedy, Horror;NA;Brian Skiba;Dominique Swain, William McNamara, Corin Nemec, Gianni Capaldi
Ask Bu Mu?;NA;NA;Comedy, Drama, Romance;NA;Ömer Ugur;Afra Saraçoglu, Kubilay Aka, Öznur Serçeler, Salih Kalyon
BÚÉK;NA;NA;Comedy, Drama;NA;Krisztina Goda;Viktória Szávai, Béla Mészáros, Éva Bata, Gábor Hevér
L'animale;100 min;NA;Drama;6.7;Katharina Mückstein;Sophie Stockinger, Kathrin Resetarits, Dominik Warta, Julia Franz Richter
It is Not the Pornographer That is Perverse...;69 min;NA;Comedy, Drama;4.6;Bruce La Bruce;Sean Ford, Calvin Banks, Allen King, Dato Foland
Cornbread Cosa Nostra;106 min;NA;Crime, Thriller;7.0;Travis Mills;Jeremy London, Peyton Wich, Juliet Reeves London, Charles Barber
Handy Dandy;NA;NA;Horror;NA;Jeff Broadstreet;Bill Moseley, Bill Oberst Jr., Jake Red, Kyle Anderson
Un Regalo Esencial;NA;NA;Comedy, Drama, Musical;5.4;Jose Mario Salas Boza;Isaias Badilla, Jaime Castro, Thelma Darkings, Marcela Negrinni
The Amaranth;NA;NA;Thriller;7.0;Albert Chi;Jeffrey DeMunn, Christopher Denham, Danielle Kennedy, Shiva Negar
Golden Boy;NA;NA;Drama;6.8;Stoney Westmoreland;Mark Elias, Lex Medlin, Logan Fahey, Paul Culos
Go for Broke;NA;NA;Drama, History, War;8.2;Alexander Bocchieri;Hideyuki Arita, Jabez Armodia, Miguel A. Baez Jr., Kanani Baker
Tazzeka;95 min;NA;Comedy;8.6;Jean-Philippe Gaud;Mahdi Belemlih, Ouidad Elma, Olivier Sitruk, Abbes Zahmani
Phamous;115 min;NA;Comedy, Crime, Drama;4.5;Karan Butani;Jimmy Sheirgill, Shriya Saran, Kay Kay Menon, Pankaj Tripathi
La Boda de Valentina;107 min;R;Comedy, Romance;4.6;Marco Polo Constandse;Kate Vernon, Tony Dalton, Ryan Carnes, Omar Chaparro
Cabaret Maxime;94 min;NA;Drama;6.6;Bruno de Almeida;Michael Imperioli, Ana Padrão, David Proval, John Ventimiglia
Laces;98 min;NA;Drama;8.1;Jacob Goldwasser;Doval'e Glickman, Evelin Hagoel, Nevo Kimchi, Yafit Asulin
Miau;NA;7;Comedy;NA;Ignacio Estaregui;Álvaro de Luna, Luisa Gavasa, José Luis Gil, Manuel Manquiña
Gavthi;152 min;NA;Drama;7.7;Anand Kumar;Kushal Badrike, Nagesh Bhosle, Yogita Chavan, Kishore Kadam
Wu Wen Xi Dong;150 min;NA;Drama;6.5;Fangfang Li;Ziyi Zhang, Xiaoming Huang, Leehom Wang, Chen Chang
Bhaagamathie;138 min;NA;Action, Horror, Thriller;7.0;Ashok G.;Anushka Shetty, Murli Sharma, Asha Sharath, Unni Mukundan
Interference;NA;NA;Crime, Drama, Mystery;NA;Linda Di Franco;Tom Wisdom, Bruce Thomas, Victoria Gabrielle Platt, Cayleb Long
Cycle;96 min;NA;Comedy;9.0;Prakash Kunte;Hrishikesh Joshi, Priyadarshan Jadhav, Bhalchandra Kadam, Bapu Awale
Break;96 min;NA;Comedy;7.1;Marc Fouchard;Sabrina Ouazani, Kevin Mischel, Slimane Nebchi, Hassam Ghancy
Grandmother's Gold;80 min;NA;Comedy;7.4;Brian Jordan Alvarez;Brian Jordan Alvarez, Stephanie Koenig, Pete Zias, Ken Kirby
Kill Me Today, Tomorrow I'm Sick!;NA;NA;Comedy, Drama;NA;Joachim Schroeder, Tobias Streck;Karin Hanczewski, Carlo Ljubek, Tommy Sowards, Eray Egilmez
Ceux qui travaillent;102 min;NA;Drama;6.9;Antoine Russbach;Olivier Gourmet, Adèle Bochatay, Elidan Arzoni, Delphine Bibet
Luz;123 min;NA;Drama;NA;Damian Chapa;Damian Chapa, Anna Martin, Vanessa Keogh, Gabriel O'Brien Chapa
Aanakkallan;155 min;NA;Comedy;7.3;Suresh Divakar;Biju Menon, Siddique, Suraaj Venjarammoodu, Kaniha
Catskill Park;NA;NA;Horror, Sci-Fi, Thriller;NA;Vlad Yudin;Lauren Francesca, Wen Yann Shih, Katelyn Pearce, Alexander Cendese
Yara;101 min;NA;Drama, Romance;8.3;Abbas Fahdel;Michelle Wehbe, Elias Freifer, Mary Alkady, Elias Alkady
Veneno;96 min;NA;Action, Drama, Sport;8.4;Tabaré Blanchard;Manny Perez, Pepe Sierra, Richard Douglas, Ovandy Camilo
Draug;NA;NA;Horror;NA;Karin Engman, Klas Persson;Elna Karlsson, Thomas Hedengran, Ralf Beck, Nina Filimoshkina
Vanjagar Ulagam;161 min;NA;Crime, Drama, Thriller;6.5;Manoj Beedha;Anisha Ambrose, Cibi Bhuvana Chandran, Hareesh Peradi, Jayaprakash Radhakrishnan
Virus of the Dead;120 min;NA;Action, Horror, Thriller;NA;Matthew Joseph Adams, Gordon Bressack, James Cullen Bressack, Dan Brownlie, Jarrett Furst, Keiron Hollett, Matt Iwinski, Benjamin James, Hunter Johnson, Christopher Jolley, John T. Mickevich, Mark Alan Miller, Kiko Morah, Tony Newton, John Penney, Nick Principe, Timo Rose, Shane Ryan, Emir Skalonja;Kathryn Eastwood, Mhairi Calvey, Jessica Ann Brownlie, James Cullen Bressack
Maybe I'm Fine;98 min;NA;Family;NA;Elizabeth Blake-Thomas;Rob Mayes, Isabella Blake-Thomas, Patti Aagaard, Flex Alexander
Hens Night;88 min;NA;Comedy, Drama, Horror;2.9;Kristian Lariviere;Jennifer Allanson, Edith Landreville, Candice Lidstone, Emily Shanley
Otzi and the Mystery of Time;90 min;NA;Adventure, Family, Fantasy;NA;Gabriele Pignotta;Alessandra Mastronardi, Michael Smiley, Deirdre Mullins, Vinicio Marchioni
Kunju Daivam;153 min;NA;Drama;9.4;Jeo Baby;Adhish Praveen, Joju George, Reina Maria, Prasanth
Soul to Keep;94 min;NA;Horror, Thriller;NA;David Allensworth, Moniere;Aurora Heimbach, Conor McKenna, Sandra Mae Frank, Derek Long
Ozen;108 min;NA;Drama;6.0;Emir Baigazin;Zhalgas Klanov, Zhasulan Userbayev, Ruslan Userbayev, Bagdaulet Sagindikov
The Control;94 min;NA;Mystery, Sci-Fi, Thriller;8.1;Eric Schiller, Michael Stasko;Kyle Archibald, Paul Daniel Ayotte, Sharon Belle, Ted Bezaire
1921;144 min;NA;Horror, Mystery, Romance;4.3;Vikram Bhatt;Zareen Khan, Karan Kundrra, Vikram Bhatt, Angela Krislinzki
The Christmas Cupid;NA;NA;Romance;NA;Michael D. Sellers;Elisabeth Harnois, Jonathan Togo, Chad Michael Collins, Sasha Jackson
Verpiss Dich, Schneewittchen;87 min;NA;Comedy;2.6;Cüneyt Kaya;Bülent Ceylan, Josefine Preuß, Paul Faßnacht, Özgür Karadeniz
Rosa Leigh;NA;NA;Horror;8.5;Christopher Maggard;Santiago Cirilo, Jessica Paige York, Gloria Bishop, Cheryl Lynn Carter
Beast Mode;NA;NA;Comedy, Horror;NA;Chris W. Freeman, Spain Willingham;C. Thomas Howell, Leslie Easterbrook, Ray Wise, James Hong
Aigaio SOS;NA;NA;Action, Comedy;NA;Pierros Andrakakos;Thodoris Atheridis, Panos Vlahos, Evagelia Siriopoulou, Michalis Leventogiannis
Kusina Kings;NA;NA;Comedy;5.7;Victor Villanueva;Zanjoe Marudo, Empoy Marquez, Ryan Bang, Nathalie Hart
Living Space;80 min;NA;Horror;6.0;Steven Spiel;Emma Leonard, Georgia Chara, Andy McPhee, Jolene Anderson
Kinavally;141 min;NA;Comedy, Horror, Mystery;8.4;Sugeeth;Sowmya Menon, Hareesh Perumanna, Surabhi Santhosh, Ajmal Zayn
Night Nurse;NA;NA;Thriller;5.7;Damián Romay, Ernesto Rowe;Sara Antonio, Christie Burson, Cynthia Evans, shalesha Monique Henderson
Edmond;110 min;NA;History;NA;Alexis Michalik;Dominique Pinon, Blandine Bellavoir, Simon Abkarian, Alexis Michalik
An Ideal Husband;NA;NA;Comedy;8.2;Jonathan Church;Frances Barber, Sally Bretton, Edward Fox, Freddie Fox
Edge of Isolation;89 min;NA;Drama, Horror, Thriller;3.3;Jeff Houkal;Michael Marcel, Marem Hassler, Alexandra Peters, Monte Markham
Hills Without Names;93 min;NA;Drama;9.1;Hilal Baydarov;Orkhan Iskandarli, Nigar Isayeva, Huseyn Nasirov, Narmin Hasanova
Tonari no kaibutsu-kun;NA;NA;Comedy, Drama, Romance;7.3;Shô Tsukikawa;Masaki Suda, Tao Tsuchiya, Yûki Furukawa, Minami Hamabe
Who's Jenna...?;95 min;NA;Comedy;9.4;Thomas Baldinger;Tracey Birdsall, Bill Sorvino, Joseph D'Onofrio, Vincent Pastore
Tuntematon mestari;95 min;NA;Drama;8.4;Klaus Härö;Heikki Nousiainen, Pirjo Lonka, Amos Brotherus, Stefan Sauk
Spitak;98 min;NA;Action, Drama;7.8;Aleksandr Kott;Mkhitar Avetisyan, Martun Ghevondyan, Lernik Harutyunyan, Joséphine Japy
Help;110 min;NA;Thriller;NA;Frédéric Cerulli;Amandine Anelli, Alain Cerulli, Frédéric Cerulli, Philippe Dahrmann
Valmentaja;111 min;NA;Biography, Drama;4.7;Tuukka Temonen;Alina Tomnikov, Ilkka Villi, Mikko Nousiainen, Leah Lamarr
Tyhjiö;97 min;NA;Comedy, Romance;7.7;Aleksi Salmenperä;Boyana Balta, Laura Birn, Hannu-Pekka Björkman, Allison Davies
Koothan;NA;NA;Musical;4.6;Venky Al;Junior Balaiya, Bhagyaraj, Manobala, Kira Narayanan
Ayka;100 min;NA;Drama;5.6;Sergei Dvortsevoy;Samal Yeslyamova, Aleksandr Zlatopolskiy
Gogol. Viy;100 min;NA;Horror, Mystery, Thriller;5.7;Egor Baranov;Sergey Badyuk, Yuliya Frants, Oleg Menshikov, Alexander Petrov
Amnesia Love;NA;NA;Comedy;6.3;Albert Langitan;Paolo Ballesteros, Yam Concepcion, Polo Ravales, Vandolph
Sarvam Thaala Mayam;NA;NA;Drama, Music;7.8;Rajiv Menon;Aparna Balamurali, Divyadarshini, G.V. Prakash Kumar, Nedumudi Venu
Les déguns;92 min;NA;Comedy;5.4;Cyrille Droux, Claude Zidi Jr.;Karim Jebli, Nordine Salhi, Xavier Alcan, Catherine Benguigui
The Burial Of Kojo;100 min;NA;Drama, Thriller;NA;Sam Blitz Bazawule;Ama K. Abebrese, Joe Addo, Henry Adofo, Kobina Amissah-Sam
Woman on the Edge;NA;NA;Drama, Thriller;4.8;Trey Haley;Rumer Willis, Jeffery Patterson, Michael Sirow, Christina DeRosa
Una vita spericolata;102 min;NA;Comedy;5.4;Marco Ponti;Lorenzo Richelmy, Matilda De Angelis, Benedetta Porcaroli, Eugenio Franceschini
Badang;105 min;NA;Comedy, Fantasy;1.1;A. Razak Mohaideen;Aliff Syukr, Fasha Sandha, Azhari Mohd Zain, Fauzi Nawawi
Parole;150 min;NA;Drama;5.6;Sharrath Sandith;Mammootty, Siddique, Suraaj Venjarammoodu, Iniya
Marilyn;79 min;NA;Drama;6.7;Martín Rodríguez Redondo;Walter Rodríguez, Catalina Saavedra, Germán de Silva, Ignacio Giménez
Rise of the Legend;NA;NA;Biography;7.5;Teng Bee;Jake Eng, Tosh Chan, Mark Lee, Yann Yann Yeo
Somos tr3s;89 min;NA;Drama;7.0;Marcelo Briem Stamm;Charly Etchévers, Flor Dragonetti, Juan Manuel Martino
The Prey;NA;NA;Action, Adventure;7.1;Jimmy Henderson;Byron Bishop, Sahajak Boonthanakit, Nophand Boonyai, Rous Mony
Nowhere Mind;105 min;NA;Thriller;7.2;Ben Nissen;Patriac Coakley, David Scott Crawford, Andrew Graves, Peter Nerad
