title;duration;certificate;genre;rating;directors;stars
Uma;NA;NA;Drama, Romance;5.3;Alain Maiki;Henry Zakka, Fabio Massimo Bonini, Ana Turpin, Orlando Delgado
The Claire Wizard Thesis;76 min;NA;Comedy;6.4;Ishak Issa;Alex Dona, James Mitry, Rose Marel, Krystal Lencova
The Auction;NA;NA;Action, Adventure, Comedy;9.4;Darlene Dalmaceda, Alex Kersting;Dayana Bailey, Hilary Becker, Cody Bradley, Darrel Carpenter
Palace;94 min;NA;Drama;NA;Andrew Paul Davis;Suzanne Sadler, Chase Crawford, Emily Sweet, Sadie Abel
Fistful of Dirt;91 min;NA;Drama;4.6;Sebastián Silva;Modesto Lacen, Dolores Pedro, Julio Gastón Ramos
Tiro e Queda;NA;NA;Comedy;NA;Ramón De Los Santos;Dinarte de Freitas, Carla Vasconcelos, Óscar Branco, Gabriela Barros
Atlanta Vampire Movie;110 min;NA;Comedy, Horror;NA;Giles Shepherd;Chelsea Howard, Carl W. Childers, Artemis, Jevocas Green
Zoufalé zeny delají zoufalé veci;NA;NA;Comedy;2.7;Filip Renc;Klára Issová, Aneta Krejcíková, Václav Vasák, Matous Ruml
Gekijôban Urutoraman Jîdo Tsunagu ze! Negai!!;70 min;NA;Action, Sci-Fi;8.3;Koichi Sakamoto;Tatsuomi Hamada, Chihiro Yamamoto, Mayu Hasegawa, Yûta Ozawa
Yi ching chun dik ming yi;97 min;NA;Drama;6.3;Wai Ching Tam;Carina Lau, Siu Hin Ng
The Frontiersman;87 min;NA;Western;NA;Tony London;Alexis M. Berg, Steve Berg, Elaine Caulfield, Estee Chambers
Rajja Rani;138 min;NA;Romance;7.2;Yam Thapa;Najir Hussain, Keki Adhikari, Kameshwor Chaurasiya, Deepak Chhetri
Tumbal: The Ritual;92 min;NA;Horror;NA;NA;Mawar Eva de Jongh, Rayn Wijaya, Karel Susanteo, Annette Edoarda
Dziura w glowie;91 min;NA;Drama;8.1;Piotr Subbotko;Bartlomiej Topa, Sandra Korzeniak, Lidia Andrzejuk, Maria Charytoniuk
Halkaa;114 min;NA;Drama, Family;8.8;Nila Madhab Panda;Paoli Dam, Vipin Katyal, Ranvir Shorey, Tathastu
Rondo;90 min;NA;Thriller;7.5;Drew Barnhardt;G.C. Clark, Ketrick 'Jazz' Copeland, Reggie De Morton, Ashley Gagnon
Jack Southeast;120 min;NA;Crime;1.9;Michael Chapman;Michael Chapman, Penny Judd, Mark Preston, Leslie Grantham
Crô em Família;94 min;NA;Comedy;3.7;Cininha de Paula;Monique Alfradique, João Baldasserini, Júlio Braga, João Bravo
Vidhi Madhi Ultaa;NA;NA;Comedy;7.2;Vijai Balaji S.;Rameez Raja, Janani Iyer, Daniel Balaji, Karunakaran
Yuva;119 min;NA;Drama;5.2;Emre Yeksan;Kutay Sandikçi, Eray Cezayirlioglu, Imren Sengel, Okan Bozkus
The Dark Web Tapes;NA;NA;Horror;NA;Jason Harlow, Jake Zelch;Harriet Rees, Amber Ruth, David Perry, Jessica Thompson
Street Dreams - Los Angeles;NA;NA;Action, Drama;NA;Jordan Cann, Romane Simon;Siya, Lester Speight, Jessica Vanessa DeLeon, Mark Krenik
Pareshaan Parinda;NA;NA;Action, Romance;NA;Devesh Pratap Singh;Meeraj Shah, Sakshi Singh, Avtar Singh Bhullar, Sadia Nabila
Lucid Dreams;91 min;NA;Drama;NA;Teddy Robin Kwan;Dada Chan, Kevin Cheng, Louis Cheung, Stephy Tang
Duke;NA;NA;Drama;NA;Thiago Dadalt;Robert Solomon, Piercey Dalton, Jeff Marchelletta, Zack Kozlow
Joseph;NA;NA;Drama, Thriller;NA;M. Padmakumar;Joju George
Rhapsody of Kidnapping;NA;NA;Comedy, Crime;NA;NA;Eric Kwok, Wu Shuwei, Chen Yuheng
Jannat;NA;NA;Crime, Drama;NA;Mustafizur Rahman Manik;Saimon Sadik, Mahiya Mahi, Aliraj, Misa Sawdagar
Bhayanakam;105 min;NA;Drama, Thriller;6.7;Jayaraj;Bilas Chandrahasan Nair, Renji Panicker, Asha Sharath
1945 From This Day;NA;NA;Drama, War;4.8;Rick Roberts;Tim Seyfert, Alexander Guiney, Fergus Rees, Gareth Bennett-Ryan
Tehran: City of Love;102 min;NA;Drama;8.0;Ali Jaberansari;Forough Ghajabagli, Mehdi Saki, Amir Hessam Bakhtiari, Behnaz Jafari
The Unfathomable Mr. Jones;NA;NA;Comedy;NA;Ice Neal;Ice Neal, Nicholas Kempsey, Steve Hope Wynne, Peter Silverleaf
What Lies Beneath;NA;NA;Drama, Mystery, Thriller;NA;Kerrick Greer, Patrick Johnson, Johnny M. Sizemore;Dalinda Brown, Marquise Byrd, Javarius Conway, Sky Cunningham
Non è vero ma ci credo;NA;NA;Comedy;NA;Stefano Anselmi;Nunzio Fabrizio Rotondo, Paolo Vita, Micol Azzurro, Loredana Cannata
The Perfect Host: A Southern Gothic Tale;93 min;NA;Drama, Horror, Thriller;NA;Derrick Sims;Suilma Rodriguez, Janis Duley, Chase Ryan Jeffery, Andersyn Van Kuren
Noel en boite;90 min;NA;Comedy;NA;Jocelyn Forgues;Janick Hebert, Zachary Amzallag, Stephane Paquette, Vincent Poirier
Curry Western;106 min;NA;Comedy;NA;Kamal Musale;Sylvain Reymond, Luca Ribezzo, Gia Sandhu, Christopher Shyer
Sacudete Las Penas;NA;NA;Drama;6.0;Andres Ibañez Diaz Infante;Arturo Barba, Daniela Barcelo, Melissa Barrera, Alejandro Calva
Meme;NA;NA;Drama;NA;Sean Mannion;Sarah Schoofs, Shivantha Wijesinha, Lauren A. Kennedy, Kitty Ostapowicz
Katyusha;90 min;NA;Comedy;6.5;Ali Atshani;Hadi Hejazifar, Ahmad Mehranfar, Mitra Hajjar, Leila Otadi
Sol Searching;100 min;NA;Drama;NA;Roman Perez;Pokwang, Joey Marquez, Gilleth Sandico, Juan Miguel Emmanuel Salvado
Siap Gan!;92 min;NA;Comedy;NA;Ody C. Harahap;Rini Mentari, Aulia Sarah, Mentari De Marelle, Qausar Harta Yudana
Busker;NA;NA;Romance;7.3;Syed Fariz;Mas Khan, Hafeez Mikail, Lia Natalia, Anas Ridzuan
The Conductor;78 min;NA;Fantasy;NA;Jeremy Mann;Nadezda Kuzmina, Tabitha Paigen, Ron Dolce, Blaire Carson
Primitiva;NA;NA;Comedy;NA;Daniel Trujillo;Michael Madsen, Kansas Bowling, Parker Love Bowling, Johnny Sins
Udalaazham;119 min;NA;Drama;NA;Unnikrishnan Aavala;Indrans, Sajitha Madathil, Mani, Anumol K. Manoharan
Nomitori samurai;NA;NA;Comedy;6.9;Yasuo Tsuruhashi;Hiroshi Abe, Shinobu Terajima, Etsushi Toyokawa, Takumi Saitoh
Uppsalakidnappningen;NA;NA;Comedy, Drama;6.4;Anders Skog;Poyan Karimi, Shirin Golchin, Peter Åström, Rasmus Luthander
Udah Putusin Aja!;88 min;NA;Drama;NA;Rolly Subhandani;Rizky Mocil, Rana Audi Marissa, Billy Davidson, Elyzia Mulachela
Sons Of Adam;114 min;NA;Crime, Drama, Mystery;6.9;Ahmed Nader Galal;Youssef El Sherif, Dina El Sherbiny, Hana El Zahed, Mahmoud El-Bezzawy
Ye Re Ye Re Paisa;142 min;NA;Comedy;7.4;Sanjay Jadhav;Bijay Anand, Pratik Chitre, Bharat Dabholkar, Tushar Dalvi
Banjara: The truck driver;NA;NA;Drama, Romance;NA;Mushtaq Pasha;Babbu Mann, Shraddha Arya, Rana Ranbir, Jia Mustafa
Hed;92 min;NA;Drama;7.4;Amikam Kovner, Assaf Snir;Yaël Abecassis, Guri Alfi, Ilanit Ben-Yaakov, Samuel Calderon
Kuch Pal Pyar Ke;NA;NA;Drama;NA;V.H. Kumar;Aamir, Tejas Gadhvi, Aamir Ghani, Zoya Rathore
Artichoke;75 min;NA;Crime;NA;Fernando Antonio Maffei;Vincenzo Nicoli, Jetinder Summan, Greg Hobbs, Francesco Tribuzio
Krew Boga;100 min;NA;History;3.4;Bartosz Konopka;Krzysztof Pieczynski, Karol Bernacki, Wiktoria Gorodecka, Jacek Koman
Removed;70 min;NA;Thriller;4.6;Kevin Forrest;Jeffrey Arrington, Michael Draper, Dennis Fitzpatrick, Nikki Flinn
4 Rah Istanbul;100 min;NA;Action, Drama;5.8;Mostafa Kiayee;Bahram Radan, Mohsen Kiayee, Sahar Dolatshahi, Ra'na Azadivar
Zone Rouge;NA;NA;Drama;8.5;Cihan Inan;Christopher Buchholz, Cihan Inan, Siir Eloglu, Nicolas Rosat
Broken Contract;95 min;NA;Action, Comedy, Crime;7.7;James Pentecost;Mona Afshar, Esther Anderson, Kelsie Anderson, Adrian Archer
Emu Runner;NA;NA;Family;5.5;Imogen Thomas;Wayne Blair, Georgia Blizzard, Rob Carlton, Maurial Spearim
Devil Within;89 min;NA;Thriller;6.9;Steve Rahaman;Seth Hendricks, Lauren Alexandria Kittrell, Erik Wegner, Lily Spellman
Fabrizio De André: Principe libero;193 min;NA;Biography;6.9;Luca Facchini;Luca Marinelli, Valentina Bellè, Elena Radonicich, Davide Iacopini
Kick Ons;100 min;NA;Comedy, Drama;NA;Abel Robinson;Yousha Abbas, Atlas Adams, Nirpesh Ahuja, Callum Alexander
Achoura;NA;NA;Fantasy, Horror, Thriller;NA;Talal Selhami;Sofiia Manousha, Younes Bouab, Omar Lotfi, Iván González
When the Fever Breaks;NA;NA;Horror;NA;Tymaine Clay;Chadwick Armstrong, Genevieve Gearhart, Ryan T. Husk, Dylan Wayne Lawrence
Julia y el zorro;105 min;NA;Drama;NA;Inés María Barrionuevo;Victoria Castelo Arzubialde, Umbra Colombo, Pablo Limarzi
Ice Dragon: Legend of the Blue Daisies;70 min;NA;Animation, Adventure, Family;NA;Bruce W. Stacey;Rheal Rees, Justin Dubé, Bill Bray, Mark Underdown
Oz Land;NA;NA;Adventure;NA;Takafumi Hatano;Erika Asakura, Akira Emoto, Motoki Fukami, Mari Hamada
Durga Rani Singh;NA;NA;Drama;5.2;Sujoy Ghosh;Irrfan Khan, Shilpa Shukla
This Day Forward;NA;NA;Family;9.1;Brian Ide;Hayden Blane, Randy Coleman, Chet Dixon, Kallen Blair
Wrestlemassacre;100 min;NA;Horror;6.4;Brad Twigg;Richie Acevedo, Tony Atlas, Julio Bana Fernandez, Jason John Beebe
L'uomo che comprò la luna;105 min;NA;Comedy;NA;Paolo Zucca;Jacopo Cullin, Francesco Pannofino, Stefano Fresi, Benito Urgu
Dünya Hali;NA;NA;Comedy;5.1;Ömer Can;Murat Dalkiliç, Melis Sezen, Eren Hacisalihoglu, Serenay Aktas
Total Dadagiri;130 min;NA;Romance;6.1;Pathikrit Basu;Yash Dasgupta, Mimi Chakraborty, Rajatabha Dutta, Shankar Chakraborty
Jatt vs. Ielts;143 min;NA;Comedy, Drama;8.0;Devi Dutt;Anita Devgan, Hobby Dhaliwal, Mandeep Ghai, Gurpreet Ghuggi
Skazhene vesillya;90 min;NA;Comedy;7.2;Vlad Dykyi;Aram Arzumanyan, Yuriy Horbunov, Aleksandr Kobzar, Vera Kobzar
Eka Dawasaka Api;NA;NA;Drama, Romance;8.6;Anuruddha Jayasinghe;Pubudu Chathuranga, Nayanathara Wickramarachchi, Veena Jayakody, Medha Jayaratne
Maniyar Kudumbam;128 min;NA;Drama;5.1;Thambi Ramayya;Yaashika Aanand, V. Jayaprakash, Mrudula Murali, Vivek Prasanna
Saremo giovani e bellissimi;92 min;NA;Drama;7.5;Letizia Lamartire;Barbora Bobulova, Alessandro Piavani, Massimiliano Gallo, Federica Sabatini
Raakshas;115 min;NA;Adventure, Drama, Family;NA;Dnyanesh Zoting;Sharad Kelkar, Daya Shankar Pandey, Sai Tamhankar
Eyes Wide Open;110 min;NA;Action, Mystery, Thriller;NA;Will Forrester;Christopher Gordon, Amy Aleha, Danton Ford, Jezreel Kang-Graham
Where the Water Runs;NA;NA;Drama, Sci-Fi, Thriller;NA;DuBois Ashong;Darryl Dunning II, Bria Wade, Joseph Callari, Kenajuan Bentley
North Blvd;128 min;NA;Drama;6.6;Amy Esacove;Ed Ackerman, John Bain, Meredith Bechtel, Chandra Bond
Peixonauta: O Filme;77 min;NA;Animation, Adventure, Family;6.7;Celia Catunda, Rodrigo Eba, Kiko Mistrorigo;Celso Alves, Fernanda Bullara, Fábio Lucindo
Lada Kamenski;71 min;NA;Comedy, Drama;8.6;Sara Hribar, Marko Santic;Frano Maskovic, Natasa Dorcic, Ksenija Marinkovic, Doris Saric-Kukuljica
Looking for Rohmer;83 min;NA;Drama;4.7;Chao Wang;Renaud Cohen, Alice de Lencquesaing, Jérémie Elkaïm, Geng Han
Trickster;NA;NA;Thriller;6.0;Jamie Paolinetti;Aimee Auclair, Rebecca Bujko, Debra De Liso, Leigh Grace
Szeretlek, mint állat!;94 min;NA;Drama;NA;Erik Novák;Franciska Farkas, Bori Péterfy, Nóra Parti, Orsi Tóth
American Antichrist;50 min;NA;Horror;NA;Dakota Ray;Larry Bay, Nick Benning, Meg Lacie Brown, Dakota Ray
What Death Leaves Behind;87 min;NA;Drama, Mystery, Thriller;8.4;Scott A. Hamilton;Christopher Mann, Vincent Young, Erin O'Brien, Johnny Alonso
Hekayat-e darya;97 min;NA;Drama;6.0;Bahman Farmanara;Bahman Farmanara, Leila Hatami, Fatemah Motamed-Aria, Saber Abar
El club de los insomnes;80 min;NA;Drama;6.0;Joseduardo Giordano, Sergio Goyri Jr.;Alejandra Ambrosi, Fernando Becerril, Humberto Busto, Cassandra Ciangherotti
Deep End;NA;NA;Drama, Romance, Sport;NA;Eubulus Timothy;Greg Kriek, Suraya Santos, Carishma Basday, Priya Lutchman
Family Circus;140 min;NA;Comedy;NA;Viral Rao;Bharat Chawda, Mitra Gadhvi, Monal Gajjar, Raunaq Kamdar
Changaa Chait;NA;NA;Romance;NA;Dipendra K. Khanal;Shishir Bangdel, Sandip Chhetri, Maotse Gurung, Rabindra Jha
Mare di grano;NA;NA;Family;NA;Fabrizio Guarducci;Ornella Muti, Sebastiano Somma, Simona Borioni, Alessandro Paci
Cold Dawn;36 min;NA;Thriller;NA;Thomas Frick;Clinton Bailiff, Ricky Collins, Sean Collins, Abigail Fleck
Legion of Doom;120 min;NA;Comedy, Drama;6.0;Gerry Galli, Oscar Frederick Welsh;Gerry Galli, John Palonka, Breanna Peesker, Julia Marcello
Kidnap Me;80 min;NA;Comedy, Crime, Romance;NA;Ross Aitken, James Browning;Daniel Curshen, Genna Foden, Ross F. Sutherland, Ray Whelan
Because I Love You;NA;NA;Romance;NA;Joel Lamangan;Afi Africa, Marvin Agustin, John Arcilla, Paulo Avelino
Kesempatan Kedu(d)a;99 min;NA;Comedy, Drama;NA;Awi Suryadi;Raffi Ahmad, Zizan Razak, Cut Meyriska, Marsha Aruan
Mother's Milk;63 min;NA;Drama;NA;Alex Ander, Shinelle Azoroh, Adriana DeGirolami, Lelund Durond, Bianca LaVerne Jones, Angela Lewis, John MacDonald, J. Mallory McCree, Kameron Neal, Larry Powell, Joey Scoma, Spencer Williams, Tobie Windham;Larry Powell, Sameerah Luqmaan-Harris, Kimberly Hebert Gregory, Jessica Frances Dukes
Hanum & Rangga: Faith & The City;90 min;NA;Drama, Romance;2.5;Benni Setiawan;Acha Septriasa, Rio Dewanto, Arifin Putra, Alex Abbad
Silicon Beach;NA;NA;Drama;9.2;Max Gold;Jacqui Anders, Libby Baker, Mickey Bloom, Libby Dowell
Rift;NA;NA;Thriller;NA;Rena Yao;Jack Yang, Yun Xie, Greg Depetro, Damian James
Sakhavinte Priyasakhi;160 min;NA;Drama, Family;3.5;Sidheeque Thamarasseri;Shine Tom Chacko, Salim Kumar, Sudheer Karamana, Kalabhavan Shajohn
Paranormal Demons;96 min;NA;Horror;7.4;David Brückner;Moloch, Kristina Kostiv, Sebastian Matthias Weißbach, David Brückner
Krina;NA;NA;Thriller;NA;Shyamal K. Mishra;Parth Singh Chauhan, Tunisha Sharma, Inder Kumar, Deepshika
Pedavi Datani Matokatundhi;131 min;NA;Comedy, Fantasy, Romance;NA;T. Guru Prasad;Ravan, Payal Wadhwa, V.K. Naresh, Moin
Sholevar;100 min;NA;Drama;6.2;Hamid Nematollah;Amin Hayayee, Zahra Hatami, Bahman Parvaresh, Farbod Ghobadi
Staycation;NA;NA;Comedy, Drama;NA;Tanuj Chopra;Anthony Ma, Grace Su, Mousa Kraish, Karin Anna Cheung
Sinterklaas en de verdwenen verjaardagsmijter;70 min;NA;Adventure, Family;NA;Raymon de Ronde;Michelle Bergsma, Sander Blanken, Richard Bosch, Robin Brouwer
Fuck my Friends;75 min;NA;Drama;7.0;Jake Burgess;Austin Amos, Isaac Brown, Andrew Burgess, Jake Burgess
Marcianos Contra Mexicanos;90 min;NA;Animation, Comedy;4.3;Gabriel Riva Palacio Alatriste, Rodolfo Riva Palacio Alatriste;Omar Chaparro, Ricardo Hill, Eduardo Manzano, Jaime Maussan
Zen sul ghiaccio sottile;87 min;NA;Drama;NA;Margherita Ferri;Susanna Acchiardi, Eleonora Conti, Edoardo Lomazzi, Fabrizia Sacchi
Sex Ed;13 min;NA;Comedy, Drama;NA;Alice Seabright;Mark Weinman, Isabella Ainslee, Harry Bailey, Ferah Baird
Corazón de león;NA;NA;Comedy;NA;Jorge Ramírez Suárez;Fernanda Castillo, Jorge Salinas, Sarah Nichols
Party Piet Pablo en de Gestolen Cadeaus;65 min;NA;Drama;NA;Alex Mensen;Okke Verberk, Chantal Prins, Liza van Eerden, Sandra Dijkstra
Kuttanadan Marpappa;140 min;NA;Comedy, Drama;5.2;Sreejith Vijayan;Kunchacko Boban, Aditi Ravi, Shantikrishna, Innocent Vareed Thekkethala
Mr. & Mrs. Cruz;116 min;NA;Drama;7.6;Sigrid Andrea Bernardo;Ryza Cenon, JC Santos, Yayo Aguila, Dennis Padilla
Di ya cao;111 min;NA;Action, Crime, Drama;5.1;Nick Cheung;Nick Cheung, Jinglei Xu, Kai-Chung Cheung, Paul Chun
The Witch;NA;NA;Horror;NA;Huy Yaleng;Huy Yaleng
Owatta hito;125 min;NA;Comedy;7.6;Hideo Nakata;Hiroshi Tachi, Hitomi Kuroki, Ryôko Hirosue, Asami Usuda
Without Limits;NA;NA;Sport;NA;James Holden;NA
Surprise;NA;NA;Horror, Mystery, Thriller;NA;Dave Green, Dan McGee;George Newton, Joerg Stadler, Laura Ellen Wilson, Patrick J. Maxwell
It's A Party;78 min;NA;Comedy;NA;Weldon Wong Powers;Ego Nwodim, Carl Tart, Tone Bell, Lamar Woods
Oreina. Ciervo;88 min;NA;Drama;6.3;Koldo Almandoz;Ramón Agirre, Patxi Bisquert, Iraia Elias, Erika Olaizola
ZOOks;90 min;NA;Animation;6.0;Dimitri Leue, Kristoff Leue;Glenn-Scott Peij, Mona Lahousse, Wouter Hendrickx, Wim Helsen
Hi-Death;102 min;NA;Horror;4.9;Anthony Catanese, Amanda Payton, Tim Ritter, Todd Sheets, Brad Sykes;Todd Sheets, Dilynn Fawn Harvey, Fabiana Formica, Renee Soproxi
My Life is a Soap;NA;NA;Comedy;NA;Richard Boyd;Nick W. Nicholson, Amey Richards, Michelle A. Robinson, L.A. Young
The Piano Man;90 min;NA;Drama;9.1;Ben Bernard;Christian Winter, Jamie Leo, Jacob Rogotzke, Abigail Dwight
Exploitation;NA;NA;Comedy;NA;Bill Zebub;Jessica Albano, Kayla Browne, Holly Gurbisz, Mel Heflin
Blue Queen;NA;NA;Action, Thriller;8.0;Alexandros Sipsidis;Themis Panou, Ikonomou Michalis, Dimitris Imellos, Dimitris Kapetanakos
According to Ben Adams;105 min;NA;Drama;4.8;Bramwell Noah, Dan Noah;Daniel Schepisi, Chloe Ng, Allan V. Watt, Michelle Falkam
Easy Money;85 min;NA;Drama;5.2;Halstan Williams;Joanna Bartling, Ashton Bingham, Skip Bolden, Zack Cole
Bhaagte Raho;NA;NA;Comedy;NA;Praful D.S. Tiwari;Riya Deepsi, Dinesh Hingoo, Mukesh Khanna, Abhay Raichand
Dark Punch;84 min;NA;Thriller;NA;Nadim Tebyanian;Joe Mayes
Sideboob;86 min;NA;Comedy;NA;Richard Rotter;Winny Clarke, Samantha Cole, Gowan, Jennifer Farrugia
Asagao to Kase-san;58 min;NA;Animation, Romance;8.0;Takuya Satô;Minami Takahashi, Ayane Sakura, Ibuki Kido
Hendi & Hormoz;90 min;NA;Drama, Romance;8.0;Abbas Amini;Hamed Alipour, Zohreh Eslami, Asma Daneh-Chin, Mohammad Banouj
Paraziták a Paradicsomban;NA;NA;Drama;5.2;Attila Kasvinszki;Lex Alexandra, Bartók Andi, Kasvinszki Benedek, Sára Bohoczki
Uqdat el-Khawagah;93 min;NA;Comedy;5.3;Peter Mimi;Maged El-Masri, Hasan El-Raddad
Implosion: Zero Day;90 min;NA;Animation, Sci-Fi;NA;Anton Mark-Hitchman;Stefanie Joosten, Stephanie Sheh
The Odd Essay;NA;NA;Comedy;NA;Tom Watts;Troy Doherty, Lilan Bowden, Wallace Angus Bruce, Jamie LaBarber
Ali;NA;NA;Adventure, Sport;NA;Sikkandhar Dulkarnain;Gafoor Koduvally, Athira, Neenu Joy, S.R. Khan Maniyur
Ambi Ning Vysaitho;NA;NA;Action, Drama, Romance;8.3;Gurudatha Ganiga;Ambarish, Suhasini, Sudeep, Sruthi Hariharan
The Dark Side of Life: Mumbai City;125 min;NA;Drama;NA;Tariq Khan;Avii, Mahesh Bhatt, Sayed Gul, Irfanouzzaman
Lilli;91 min;NA;Thriller;7.9;Prasobh Vijayan;Kannan Nayar, Dhanesh Anand, Aaryan Menon, Samyuktha Menon
Blezi;NA;NA;Comedy, Romance;3.9;Andrejs Ekis;Intars Resetins, Ieva Florence, Ralfs Eilands, Rezija Kalnina
Gate Way;NA;NA;Horror;NA;Niall Owens;Kevin Barry, Tim Creed, Ian de Brí, Maria de Brí
Made on Merseyside - The Beatles;87 min;NA;Music;NA;Alan Byron;Frank Allen, Keith Altham, Pete Best, Roag Best
Rose is not a Flower;NA;NA;Family;NA;NA;Katie Layman, Sabrina Layman, Demetrius Stephens
The Pastor and the Pro;80 min;NA;Comedy;3.5;Matthew Wilson;Kelly Cunningham, Travis Lincoln Cox, Jeffrey Arrington, Andrew Tribolini
Verlorene;91 min;NA;Drama;7.2;Felix Hassenfratz;Anna Bachmann, Maria Dragus, Meira Durand, Clemens Schick
Dreams of Darkness;83 min;NA;Horror, Thriller;NA;Nicholas Malden;Miles Jonn-Dalton, Pia Bertucci, Renee Domenz, Libby Amato
The Astronot;72 min;NA;Drama, History;NA;Tim Cash;Pennan Brae, Kiran Cash, Tim Cash, Brittany Dixon
Salam Pakistan;120 min;NA;Comedy, Mystery, Romance;8.7;Hassan Zee;Naghma, Ali Raza, Meerab Khan, Mirza Shabbir
Atal Faisla;NA;NA;Drama;NA;Abdul Sattar;Sahil Akhtar, Himayat Ali, Aman Jain, Sheetal Kale
Maniacal;NA;NA;Horror;NA;Jackson Batchelor, Peter Goddard, Gav Chuckie Steel, Rachel Stephens, Benjamin Sutton, Rob Ulitski, James Atkins, Sam Mason-Bell, Wesley Skelly;Harry Bartholomew, Simon Berry, William Coomber, Kevin Cordell
Bimbo Bambino;NA;NA;Action, Comedy, Drama;NA;Alexi Carpentieri;Victor Poturaj, Byron Reimer Ward, Frej Wells, Musa Malik
Rescue Bus 300;75 min;NA;Thriller;NA;Rotem Shamir;Daniel Gal, Carlos Gharzuzi, Yaniv Levi, Dan Mor
Involution;84 min;NA;Drama, Sci-Fi, Thriller;6.6;Pavel Khvaleev;Dennis Hurley, Ryan Masson, Alyona Konstantinova, Karsten Mielke
Falsafa;135 min;NA;Action, Drama, Thriller;NA;Himanshu Yadav;Sushil Dahiya, Tarun Dhingara, Ridhima Grover, Sumit Gulati
One and a Half Prince;105 min;NA;Drama;6.1;Ana Lungu;Iris Spiridon, Marius Manole, István Teglas, László Mátray
Ponokku tanpen gekijô: Chiisa na eiyû - Kani to tamago to tômei ningen;NA;NA;Animation, Family;NA;Yoshiyuki Momose, Akihiko Yamashita, Hiromasa Yonebayashi;Fumino Kimura, Joe Odagiri, Machiko Ono, Kentarô Sakaguchi
Taken Notes;NA;NA;Drama;NA;James Watts;Delane Bracken, Lec Zorn, Ryan Yates, Anissa Wood
American Tender;83 min;NA;Action, Drama, Romance;NA;C.J. Renner;Nick Christopulos, Frank Foster-Bolton, Jeremy Frandrup, Nelle June Anderson
An Impossibly Small Object;100 min;NA;Drama, Fantasy;6.2;David Verbeek;Lucia, Chen-Hung Chung, David Verbeek, Klara Mucci
Radio Silence;120 min;NA;Sci-Fi;NA;Troy Scoughton Sr.;Stephanie Frias, Frank Powers, Jack Lutz, Gonzalo Robles
Deacon;NA;NA;Drama, Horror, Mystery;NA;Tyler Cole;Bradley Pierce, Tyler Cole, Ken Duncan, Leigh Nieves
La Tigresse du Darknet;NA;NA;War;NA;Julien Pelletier;NA
Cuties;88 min;NA;Horror;NA;Joshua Gratton;Olivia Begg, Davey Calderon, Jake Cameron, Catherine Churchill
Bounded by Evil;NA;NA;Drama, Mystery;NA;Eli Gray;JP DeStefano, Sheri Oster, John Maciag, Julie Oliver-Touchstone
Professor Mack;NA;NA;Romance;NA;Christopher Nolen;Robert Christopher Riley, Amin Joseph, Erica Hubbard, Timon Kyle Durrett
The Seagull;125 min;NA;Comedy, Drama;NA;Christiaan Olwagen;Sandra Prinsloo, Marius Weyers, Rolanda Marais, Deon Lotz
Autorsha;NA;NA;Comedy;NA;Sujith Vaassudev;Anusree
Die Rückkehr des Daumens - Thumb of the Tiger;NA;NA;Drama;9.2;Florian Schmidt-Convey;Thomas Burianek, Christoph Eder, Manfred Fuchs, Oliver Gehmayer
Ulaskawienie;100 min;NA;Drama;7.7;Jan Jakub Kolski;Grazyna Blecka-Kolska, Jan Jankowski, Michal Kaleta, Michal Benkes
Congratulations Debby;75 min;NA;Drama;NA;Roger Hayn;Jennifer Dorr White, J. Dixon Byrne, Dana Berger, Theodore Bouloukos
Gemina Vitae;82 min;NA;Drama;NA;Mikael Bartolomeus Winberg;Roman Andrén, Nina Christensen, Sara Marie Costa, Mattias Linderoth
Het geheim van Sophia;NA;NA;Family;NA;Yvonne van der Haven;Jada Borsato, Sepp Ruiters, Aysegul Karaca, Aldo Rotterdam de Jong
O Banquete;104 min;NA;Drama, Thriller;6.3;Daniela Thomas;Rodrigo Bolzan, Caco Ciocler, Georgette Fadel, Fabiana Gugli
Chata na prodej;77 min;NA;Comedy;6.6;Tomás Pavlícek;Ivana Chýlková, David Vávra, Tereza Voriskova, Michael Pitthan
Reverend;NA;NA;Thriller;NA;Blake Emory;Yvelisse Cedrez, Ryan Cook, Yessenia Cossio, Adam Courtney
Mary for Mayor;NA;NA;Comedy, Family;NA;Chris Aronoff, Corbin Bernsen;Corbin Bernsen, Cameron Protzman, Robert Shepherd, Kera O'Bryon
Iruttu Araiyil Murattu Kuthu;119 min;NA;Horror;4.4;Santhosh P. Jayakumar;Yaashika Aanand, Arya, Gautham Karthik, Karunakaran
Nannu Dochukunduvate;149 min;NA;Romance;7.2;R.S. Naidu;Sudheer Babu Posani, Nabha Natesh, Rajsekhar Aningi, Viva Harsha
One Night in Bath;NA;NA;Comedy, Romance;NA;Martin Owen;Sylvia Syms, Camilla Cleese, Henning Wehn, Russell Kane
Pornomochi;117 min;NA;Crime, Drama;9.3;Koushik Kar;Ritobroto Mukherjee, Anindya Pulak Banerjee, Ankita Chakraborty, Santilal Mukherjee
Amado;NA;NA;Romance;NA;Sean K. Lambert;Robert Livingston, Sean Owens, Sara Oliveri, Sophie Sakson
Lima;110 min;NA;Drama;7.1;Harvan Agustriansyah, Lola Amaria, Adriyanto Dewo, Tika Pramesti, Shalahuddin Siregar, Agha Fahriansyah;Prisia Nasution, Yoga Pratama, Baskara Mahendra, Tri Yudiman
Transfert;103 min;NA;Drama, Thriller;6.3;Massimiliano Russo;Rossella Cardaci, Giuseppe di Noto, Giulio Fodale, Matteo Martorana
We Hope for A Blooming;NA;NA;Family, Sport;NA;Yûichirô Hirakawa;Yû Inaba, Hayato Isomura, Rika Izumi, Takumi Kitamura
Just Between Us;106 min;NA;Adventure, Comedy, Drama;6.9;Christopher Kay;Deanna Ortuso, Joanne Nguyen, Calista Fooks, Kaarin Fairfax
The Bleeding Game;77 min;NA;Horror;2.8;NA;Sean-Michael Argo, Shey Bland, C. Jason Bolton, Imro Burnett
Real Resident 3;90 min;NA;Action, Adventure, Horror;NA;Geoffrey Henderson;Gregory Couch, Christine A. Jordan, Chanta Willis, Madison Sturges
Twilight: The Story of Hope;NA;NA;NA;7.7;Reggie Benjamin;Pooja Batra, Faith Evans, Larry Thomas, Matt Goss
Sly;90 min;NA;Comedy, Drama;NA;Kamal Tabrizi;Vishka Asayesh, Hamed Behdad, Mani Haghighi, Mohammad Amir Naji
Duboki rezovi;75 min;NA;Drama;9.2;Filip Mojzes, Filip Peruzovic, Dubravka Turic;Zivko Anocic, Lily Antic, Lana Baric, Milivoj Beader
Pierdete entre los muertos;65 min;NA;Adventure, Drama, Horror;5.5;Ruben Gutierrez;Anajosé Aldrete Echevarria, Horacio Salinas
À 2 heures de Paris;80 min;NA;Comedy;7.8;Virginie Verrier;Erika Sainte, Matilda Marty-Giraut, Fred Testot, Thierry Frémont
Go Home - A casa loro;84 min;NA;Horror;NA;Luna Gualano;Antonio Bannò, Sidy Diop, Shiek Dauda, Cyril Dorand Domche Nzeugang
Fight!;NA;NA;Action, Drama, Thriller;8.5;Jason Lupish;Erica Sherwood, Gabriella McAlpine, Tino Notarianni, Jennifer Farrugia
Live from the Astroturf: Alice Cooper;NA;NA;Music;NA;Steven Gaddis;Chris Penn, Alice Cooper, Michael Bruce, Dennis Dunaway
Uronchondi;101 min;NA;Drama;NA;Abhishek Saha;Arjaa Banerjee, Sudipta Chakraborty, Jayanta Hore, Koushik Kar
O chyom govoryat muzhchiny. Prodolzhenie;99 min;NA;Comedy;6.3;Flyuza Farkhshatova;Leonid Barats, Aleksandr Demidov, Rostislav Khait, Kamil Larin
Budjenje u strahu;48 min;NA;Drama;9.7;Mario Merdzan;Angela Anocic, Csilla Barath-Bastaic, Robert Budak, Alan Katic
Bricked;92 min;NA;Drama;NA;Aleshia Cowser;Tracy Campbell, Terrence 'T.C.' Carson, Shavonia Jones, Tasia Grant
Amsteroid;NA;NA;Sci-Fi;5.4;John Higbie;Mike Ancrile, David Beaulieu, Canton Belanger, Mark Bernstein
Circle of Steel;NA;NA;Drama;7.3;Gillian McKercher;Katy Doucette, Meg Farhall, Christian Goutsis, Chantelle Han
Jazz Hands;NA;NA;Family;NA;Kevin Lien, Steven Song;Kira Murphy, Rae Rezwell, Logan Fabbro, Emilia McCarthy
Kimi no tori wa utaeru;NA;NA;Drama;7.2;Shô Miyake;Tasuku Emoto, Shizuka Ishibashi, Shôta Sometani
21 ke la;NA;NA;Comedy;4.8;Nian He;Dilraba Dilmurat, Chengpeng Dong, Jingfei Guo
In Plainview;NA;NA;Crime, Thriller;8.1;Matt Watterworth;Shaun Johnston, Aaron Douglas, Chantal Perron, Brady Roberts
13: The Haunted;107 min;NA;Horror;5.6;NA;Al Ghazali, Mikha Tambayong, Valerie Thomas, Achmad Megantara
Jai Bhole;138 min;NA;Comedy;6.3;Ashok Sharma;Khagendra Lamichhane, Saugat Malla, Swastima Khadka, Buddhi Tamang
Azaadi;NA;NA;Action, Drama, Romance;6.6;Imran Malik;Moammar Rana, Sonya Hussyn, Nadeem Baig, Javed Sheikh
Swapnajaal;141 min;NA;Drama, Romance;8.1;Giasuddin Selim;Yash Rohan, Pori Moni, Fazlur Rahman Babu, Misa Sawdagar
Nude: Chitraa;NA;NA;Drama;7.9;Ravi Jadhav;Om Bhutkar, Madan Deodhar, Neha Joshi, Chhaya Kadam
